Javanese court officials,anoniem,," anonymous, Java",nl,ca. 1820 - ca. 1870, ? Java, oil on paper,Rijksmuseum,ca. 1820 - ca. 1870,https://lh3.googleusercontent.com/E9pbUweicSThUFBXpATvlWlzEFp4kW4eibMjhZ91a9cKjTnloUd0Uu6M5VsVahCHo0bqyM9Y3GlrMFBfZ9Wth-KCj7U=s0
Arcadian landscape with music-making and dancing shepherds,Jurriaan Andriessen,," Jurriaan Andriessen (12-Jun-1742 - 31-Jul-1819), Amsterdam",nl,1771, Amsterdam, oil on canvas,Rijksmuseum,1771,https://lh3.googleusercontent.com/x2jPvycxckMAbVyewjV0BxN865o_DKzh3BGtLbWRut38JWQxyqqqbAmu26j6a1ouM-vDGYZ81PNoIIW8285EJ_XH8dE=s0
Forest landscape with hunter,anoniem,," anonymous, Antwerp (city)",nl,1646, Antwerp (city), oil on panel,Rijksmuseum,1646,https://lh5.ggpht.com/FMvXVKdjnhG52Zia4aLAAPhneJR_CyceAZiGNzgbYQ-K-0SHB_aak0MKaSiPAYE3dhGt6QgdmfWFsP8KKqJr4ZtGqA=s0
Portrait of Isaac de Bruijn (1872-1953),Jan Veth,," Jan Veth (18-May-1864 - 01-Jul-1925), Netherlands",nl,1922, Netherlands, oil on canvas,Rijksmuseum,1922,https://lh3.googleusercontent.com/KKaxULPpLPZXg9p73UqAskX1reTMy47-5LSVuoxuFECZ2qzYzHhwd4TSfBqrCnKZTHcd7F_t_VjLruQFUlmIPdNd550J=s0
The painter George Jan Hendrik Poggenbeek (1853-1903) in his studio,Theo Hanrath,," Theo Hanrath (22-Sep-1853 - 10-Sep-1883), Netherlands",nl,1872, Netherlands, oil on panel,Rijksmuseum,1872,https://lh6.ggpht.com/ci8eK1K5ombkmnFnIUhkfYBlhD8DbKcaJEEB9QkrpQmHZWHWjNC5zZdME7hrePCRoU0VfPV_gvwTe7cjDlxHUcteLys=s0
Anemones,Floris Verster,," Floris Verster (09-Jun-1861 - 21-Jan-1927), Leiden",nl,1888, Leiden, oil on canvas,Rijksmuseum,1888,https://lh4.ggpht.com/mxUB_7du4kSwNM-AiPjog01V_KkMKgRKoATZhxB2SbINRYf2yen0S4uueHHGMwYJoxu01jrfpk_N_6addom_qT_WT2k=s0
Heinrich Gottfried Theodor Crone (1766-1855),Jan Philip Simon,," founder of the merchant company HGTh. Crone in Amsterdam, Jan Philip Simon (01-Oct-1796 - 13-Apr-1838)",nl,1810 - 1838, Netherlands, Netherlands,Rijksmuseum,1810 - 1838,https://lh3.ggpht.com/E_KFxWojg9-p2zyrk9joV6DSbsBxX7-reIrWAS5qSk1oUbgweht-iEzoKNtAif-2IqUUlGCuQQOFAf9GawuxpnZ37WU=s0
Winter view with setting sun between trees,Louis Apol,," Louis Apol (06-Sep-1850 - 22-Nov-1936), Netherlands",nl,1880 - 1930, Netherlands, oil on canvas,Rijksmuseum,1880 - 1930,https://lh3.googleusercontent.com/eAvX8DGKfuUAkjEqkTVaaDpbRk11yWdBysrmD8ecGPTVHIDmHf-4kGJDOtDdrj9rf_-sm4fto9_td-i4OeqMN4kXz1H1=s0
Allegory of the Tractate of Friendship and Commerce between their High Powers,anoniem,," the States General of the United Netherlands and the United States of America, The Hague",nl,1782 - 1785, October 7, 1782,Rijksmuseum,1782 - 1785,https://lh6.ggpht.com/OJeeCz_pulsTYOfxITKmWvNa6hahuFjjigirnvrEEKxn4N0lB7lya__FF3hDPb1-vDxecYcA85xYjBPU1H1UlZcqj7w=s0
Maria Petronella Mann (1778 - 1825),Jan Philip Simon,," wife of Heinrich Gottfried Theodor Crone, Jan Philip Simon (01-Oct-1796 - 13-Apr-1838)",nl,1810 - 1838, Netherlands, Netherlands,Rijksmuseum,1810 - 1838,https://lh6.ggpht.com/m9G3O3tDJi05lDvsr0sM4OZJPVbuwvyWzdwytZncKHzbs4dmM-AgBg78xDXBc3qqtbaA8ixd48xOipJAC_PWusr3nQ=s0
Portrait of Jacob Maris,Matthijs Maris,," Matthijs Maris (17-Aug-1839 - 22-Aug-1917), Netherlands",nl,1857, Netherlands, oil on paper on panel,Rijksmuseum,1857,https://lh5.ggpht.com/BeB_RZe6D5yTRpc6pLgl6bvd1x82VsHq865hAUFu67EFPkbg8ou3o9_ZwrNE2-IvY_yeRPemvXgeLpTp9P4IlX9tcCI=s0
Portrait of Eva Goudriaan-de Veer,Cornelis van Cuylenburgh (II),," Cornelis van Cuylenburgh (II) (1758 - 22-Sep-1827), Netherlands",nl,1776, Netherlands, oil on canvas,Rijksmuseum,1776,https://lh4.ggpht.com/yCDuewLTmpVxeSAyTPK4T8J_xkt8GC0AShCWSf8JurmC28ytal_clUyY-zJ_31KjI4b2055fOOI7vjf0Fss79DB-H5Q=s0
Portrait of the sculptor Pier Pander (1864-1919),Thomas Cool,," Thomas Cool (25-Dec-1851 - 16-May-1904), Rome",nl,1893 - 1894, Rome, oil on canvas,Rijksmuseum,1893 - 1894,https://lh3.ggpht.com/C8z1h3Gw10I9He-eE5G94wsVvEuzwsbPOUHeCiwkvR3-_HiZNvp3CywoNxb1SRAr3b_Q2gc9mTz_42Sw6pAqrgO2zw=s0
Landscape with the Conversion of Saul,Kerstiaen de Keuninck,," Kerstiaen de Keuninck (c. 1561 - c. 1635), Flanders",nl,1600 - 1625, Flanders, oil on panel,Rijksmuseum,1600 - 1625,https://lh3.googleusercontent.com/Zo8Wlxzs3Frs8RPljTpCPcGsm62M7cSv0urc2IjU0t-HXwB4IC3k4Qk8rQUa-_DVz_YbbRXThcAuSoklF62ROO0k-mQ=s0
Portrait of Hortense de Beauharnais,Anne-Louis Girodet-Trioson,," Queen of Holland, Anne-Louis Girodet-Trioson (29-Jan-1767 - 08-Dec-1824)",nl,ca. 1805 - ca. 1809, Paris, Paris,Rijksmuseum,ca. 1805 - ca. 1809,https://lh3.googleusercontent.com/Ml1CYAC9mV-ASxeYXEQZ4lMQcCVPW4wqY0dk54b76nAq6FZ3LX6VsyVSh-XvoPT3Qk30rnV7_f8q9h6Fj7VeX2aAIdb3=s0
Amsterdam as the center of world trade,Pieter Isaacsz.,," Pieter Isaacsz. (1569 - 14-Sep-1625), Amsterdam",nl,ca. 1604 - ca. 1607, Amsterdam, oil on panel,Rijksmuseum,ca. 1604 - ca. 1607,https://lh3.googleusercontent.com/28u97kC5VZbo1fzyXNiljkYW3CLxL-5NLhN3MHAfmxAlCsTRoOhOSZ_RRM8TPefwEI_PsalKTNhytcjuQQki5ExfIXB8=s0
The army camp in Rijen,anoniem,," anonymous, Netherlands",nl,1831 - 1835, Netherlands, oil on canvas,Rijksmuseum,1831 - 1835,https://lh3.googleusercontent.com/re2AodO5KdaYmDzywUY9Rjcv2D6EPhhJrJoCQQXGVeuMK3oSnzZFJVYUw6eVFm9sHjCFO0XVMXW8uFqk5aMGRLBec1o=s0
Portrait of Dr. PJH Cuypers (1827-1921),Thérèse Schwartze,," Thérèse Schwartze (20-Dec-1851 - 23-Dec-1918), Netherlands",nl,1885 - 1918, Netherlands, oil on canvas,Rijksmuseum,1885 - 1918,https://lh3.googleusercontent.com/LS6yh8g59FXgcbmKJulyiGJAixyxlP52WlqF0SYwKjIxYWNTCVPyE7l2BX4vRSDiJKSsNTHpgiW8xgImWw-d4SClVg=s0
Portrait of a wounded KNIL soldier,Isaac Israels,," self-signed Isaac Israels (03-Feb-1865 - 07-Oct-1934), Harderwijk",nl,1882, Harderwijk, oil on hardboard,Rijksmuseum,1882,https://lh3.googleusercontent.com/nQNU6Vqc3Je4uCQXjBNGMR8-ewZJAaRsfjCmqCSwrV0fTPSBxIMNChi8EBMs9LklRbSgqedjS7ocBrDUGNx7qp3xnw=s0
Christ the Savior,anoniem,," Anonymous, Southern Germany",nl,ca. 1500, Southern Germany, oil on panel,Rijksmuseum,ca. 1500,https://lh5.ggpht.com/zHv8ST72KaoY863GVjS0ksPYpfxLHkXdQti9He7OpH631-VOfy2NzIB-1p-mJWQh0XwTUc36Nxnu0K0rTL8sVL-hO1oy=s0
Sand excavation,Johannes Tavenraat,," Johannes Tavenraat (20-Mar-1809 - 02-Apr-1881), Netherlands",nl,1839, Netherlands, oil on paper on hardboard,Rijksmuseum,1839,https://lh6.ggpht.com/IMRI-aoJROIyyBH0PWReIYK7K-tPUD7wf7DwWGElGJh27pXaqcowA0K4tZGq1yrj9_QtxiyOdKjgvuWiF0it7wfSFUY=s0
View in the park of the Villa Chigi near Ariccia,Abraham Teerlink,," Abraham Teerlink (05-Nov-1776 - 26-May-1857), Rome",nl,1822, Rome, oil on canvas,Rijksmuseum,1822,https://lh3.googleusercontent.com/TRu9Ze2X-sv_dpkNO9HIpShNG-qibb-XncU2n_vVT4sgzin3bEfBfJ_1M-lEmuzeF9pBCLWIc65kp7RcgOkCT4g0nDyJ=s0
The painter in his studio,Anthony Oberman,," Anthony Oberman (25-Jul-1781 - 20-Oct-1845), Netherlands",nl,1820, Netherlands, oil on canvas,Rijksmuseum,1820,https://lh3.googleusercontent.com/v9yYWLlBrBusIJlywWeFgtHVsz1C_9qOp6cBO_LqJFwLI0jSA6AAL_NaD8Ny1zIMKvRxt3TElyE2xJbEc0erHRawNPo=s0
Dutch merchant with two enslaved men in\nhilly landscape,anoniem,," anonymous, Indonesia",nl,1700 - 1725, ? Indonesia, oil on canvas,Rijksmuseum,1700 - 1725,https://lh3.ggpht.com/2n6MDIba6Z9dQpvS9eTYYmV8DRCC5ORkCGQAeTQNb7JBLw4qD9YX1DOGFnDipQdANBcytVzekaPpGERU7bPUrkzG5JA=s0
Maria,anoniem,," anonymous, Southern Germany",nl,ca. 1500, Southern Germany, oil on panel,Rijksmuseum,ca. 1500,https://lh4.ggpht.com/R36iKX-RnmD0h3_UoxRLHsi5JVYwsVbstuaPv7RbgSJOcAL-DeAb0JbWEAgSWkxKrfnK2oqdwKi365tirdp15ZYNQPQ=s0
Portrait of Dina Lems,Daniel Vertangen,," wife of Jan Valckenburgh, self-signed Daniel Vertangen (04-Jan-1601 - 1684)",nl,ca. 1660, Amsterdam, Amsterdam,Rijksmuseum,ca. 1660,https://lh3.googleusercontent.com/i_Q8-9ooXILCOguj6-aWGVkxRRJ7QTSyR-dx_EKdhNvaM-3C06IJizzziTCl3xG_xcaiLKADXdmSb5YVXtlnUaOMw1yT=s0
Portrait of Jan Valckenburgh and an enslaved servant,Daniel Vertangen,," self-signed Daniel Vertangen (04-Jan-1601 - 1684), Amsterdam",nl,ca. 1660, Amsterdam, oil on canvas,Rijksmuseum,ca. 1660,https://lh3.googleusercontent.com/i0lTAbnhEtGogIbN4ixwqdy9wsLyiMrbAAwViQtI5JBcD92_GkGit5639jbAtLn4p-6DkuHnJqLD--o2ARbDTfKKog=s0
Jacoba van Beieren (1401-1436),anoniem,," Countess of Holland and Zeeland, anonymous",nl,na ca. 1480, Northern Netherlands, Northern Netherlands,Rijksmuseum,na ca. 1480,https://lh3.googleusercontent.com/udS6AdmLbyr7u8NUMOgcWcTqYjlMM9RCejunpAkVaPEF4rqqWwVjj5jAMhhHkZYX2SBYZYblkP2eBDrQjWEvr7_FMg=s0
The Calvary,Pseudo Jan Wellens de Cock,," Pseudo Jan Wellens de Cock, Leiden",nl,ca. 1520, Leiden, oil on panel,Rijksmuseum,ca. 1520,https://lh3.googleusercontent.com/h2oqFIrn0PN4I14zXDcxOLx5Zq9T7sKeMczitVMApIPAbf74UVtNKdxMWBr1BDULEgwE5O8cYEwOOW_VzXlV0l7SGFs=s0
Portrait of the family of Adrianus Bonebakker with Dirk L. Bennewitz,Adriaan de Lelie,," self-signed Adriaan de Lelie (19-May-1755 - 30-Nov-1820), Northern Netherlands",nl,1809, Northern Netherlands, oil on canvas ,Rijksmuseum,1809,https://lh3.googleusercontent.com/K66IktQgbV7mm8FJpiCCZ2Jk8RcTve9mgXVG2msUajjQQR2EKrKHVDJAJwLEx_zA0X3GWr9tVlc5tUI2SlO4puUxRw=s0
View of the Gardens of Villa Medici,Michel-Martin Drolling,," Michel-Martin Drolling (07-Mar-1786 - 09-Jan-1851), Rome",nl,1811 - 1816, Rome, oil on canvas,Rijksmuseum,1811 - 1816,https://lh3.googleusercontent.com/Hgkq5lNGjaPNdRS7YD73XwIYtAZ5qEhpw56jqi_gzdN1R7vuqZBnDxbDD9CNy8an3q5Ac-qW71wJcrGe7KZAjAkH0Q=s0
View of the Golden Bend in the Herengracht,Gerrit Berckheyde,," Gerrit Berckheyde (06-jun-1638 - 14-jun-1698), Amsterdam",nl,1671 - 1672, Amsterdam, oil on panel,Rijksmuseum,1671 - 1672,https://lh3.googleusercontent.com/Rvymv3LXhOcFOVnZpZSGoUJ8oMGjFyOmc-Ys43EMqe9QfpJYc4j5Mg9B8goHKH8gwJSKAhTDj2VeT2T3s8Sn1eu2QrY=s0
Oostzijdse windmill on the Gein by moonlight,Piet Mondriaan,," self-signed Piet Mondriaan (07-Mar-1872 - 01-Feb-1944), Netherlands",nl,ca. 1903, Netherlands, oil on canvas,Rijksmuseum,ca. 1903,https://lh3.googleusercontent.com/mFz6IniDfFsRJefOJKRMXHyG8oovlPe8rTCaxKcvcrTt2o8aki_f7f_E1qqDHrl16ZMrlmeJAYpPpCjjEaOV2iGllQ5W=s0
Portrait of Jan van Huysum,Arnold Boonen,," Arnold Boonen (1669 - 02-Oct-1729), Northern Netherlands",nl,ca. 1720, Northern Netherlands, oil on canvas,Rijksmuseum,ca. 1720,https://lh3.googleusercontent.com/zjPmEcPC1KFd7nrkek7rYrRQepPyTu7AFf1JqeMiJ6m-AkOYCVHjpDr9SmmHDHdgJ1gN2gPQO18sR-lntTAOaST5EQ=s0
Portrait of an unknown man,Jan Jansz Mostaert,," Jan Jansz Mostaert (1485 - 1553), Mechelen",nl,ca. 1525 - ca. 1530, Mechelen, oil on panel,Rijksmuseum,ca. 1525 - ca. 1530,https://lh3.googleusercontent.com/tiR09-ZW7ykk4BoZtNyV1cdvZNhgf537iC7YCUOr2JcUVyQK-qTwVbVTLY9b0wp_5ddjigC6p1DDKII6k-K-K-72-yuQ=s0
Fantasy Landscape with Saint Carlo Borromeo,Henry Ferguson,," Henry Ferguson (1665 - 1730), France",nl,ca. 1700 - ca. 1720, ? France, oil on canvas,Rijksmuseum,ca. 1700 - ca. 1720,https://lh3.googleusercontent.com/vlyX61XGYhaadY3C8Bf3abDxyXrLCv3TICD93LjNERio0vXuEoow-PcL-YHZpDy6IyI8LxjpI-0J2U_OK_arYtk6w0Y=s0
Hugo de Groot at a young age,Arnoud van Halen,," Arnoud van Halen (1673 - 15-Jul-1732), Amsterdam",nl,1710 - 1719, Amsterdam, oil on pewter in gilt lead frame on wood frame,Rijksmuseum,1710 - 1719,https://lh5.ggpht.com/bqIfSy-2qC7SrQp_tfjRmDVwse7LH2ZbJZkD9K_JoaXTIyZzSLA_IfmMWHjpc64znj73G3u7Z1xvhIRhCuDQVf-D_tc=s0
Portrait of Frank van Borselen (c. 1390-1470),anoniem,," Lord of Sint Maartensdijk, Anonymous",nl,na ca. 1480, Northern Netherlands, Northern Netherlands,Rijksmuseum,na ca. 1480,https://lh3.googleusercontent.com/AVXaP0tuMf9zLdB4B6UW_OUCwMmeZyvx9-kG4moPZAVITB5RcRUemcmv5t7XS1fwdYKPXmiJQ5MiE-JX_HkNe0H2cWo=s0
Arcadian landscape with setting sun,Daniël Dupré,," Daniël Dupré (20-Dec-1751 - 04-Jun-1817), Amsterdam",nl,1792 - 1809, ? Amsterdam, oil on canvas,Rijksmuseum,1792 - 1809,https://lh5.ggpht.com/Lpa9xn-t2T5o-FQkrH42iIf5VTi-OL5kdpN6_R3xv55HAfXNLLYzoVkSZPr2r5TO0hqurYmOGFrkZXVV24aLm6UcczXM=s0
View of Civita Castellana,Daniël Dupré,," self-signed Daniël Dupré (20-Dec-1751 - 04-Jun-1817), Amsterdam",nl,1792 - 1809, ? Amsterdam, oil on canvas,Rijksmuseum,1792 - 1809,https://lh5.ggpht.com/U8ve9GkiAuXsNExr7CWc8FE0UPq-8G_mbrnCyk5hVF1xYI0VirXc5WVQR-dBGwYnbsT8uDGCZaE7jBYC6X57uFa2S_Qa=s0
Wallpaper painting with bacchante,Jurriaan Andriessen,," Jurriaan Andriessen (12-Jun-1742 - 31-Jul-1819), Amsterdam",nl,1786, Amsterdam, oil on canvas,Rijksmuseum,1786,https://lh3.googleusercontent.com/lHXWFZ__Bnd_LGvKa_ajqkbw3CGvl4eV6NAjosQ5gEl-W3m5i0RWFkbLfvq4KKjGJMEu6epw2oVp4h9DSCZn2TBF670=s0
The Holy Virgin,Geertgen tot Sint Jans,," atelier van Geertgen tot Sint Jans (c. 1465 - ca. 1495), Haarlem",nl,ca. 1495, Haarlem, oil on panel,Rijksmuseum,ca. 1495,https://lh3.googleusercontent.com/qjkiSAC89H2lvsgogjCe6WGLzMFNgdoCLHwRngvUX6BACTFTggkzIXE99tz9Em-hTf44MS9YeRsxCjDkW7tfC9lprw=s0
Girl with a broad hat,Caesar Boëtius van Everdingen,," Caesar Boëtius van Everdingen (1617 - 13-Oct-1678), Northern Netherlands",nl,ca. 1645 - ca. 1650, Northern Netherlands, oil on canvas,Rijksmuseum,ca. 1645 - ca. 1650,https://lh3.googleusercontent.com/7SCpHk2od2XtCFtdEi9fUT91F7CwawoLPWH5Jlrkksv79_JST7-dBpvuBWqjr65LQc8z_8O2lxQvQJFlfE763Da6REE=s0
Mary with Jesus and four holy virgins,Meester van de Virgo inter Virgines,," Master of the Virgo inter Virgines, Northern Netherlands",nl,ca. 1495 - ca. 1500, Northern Netherlands, oil on panel,Rijksmuseum,ca. 1495 - ca. 1500,https://lh3.googleusercontent.com/i2HY8yKUt7mJoqJaH_aBDPi4rv0SKgdXWLOFIvpK9r92qwusjAwsqtxD1OB6Cpo0Htk12aTLA37AG4BKzTvjqElmXj4=s0
The breakthrough of the Sint-Anthonisdijk near Amsterdam,Jan Asselijn,," Jan Asselijn (1610 - Oct-1652), Amsterdam",nl,1651, Amsterdam, oil on canvas,Rijksmuseum,1651,https://lh3.googleusercontent.com/UnTn_C-Tur3QJzMp_m56tQ0HO2-YOeV7C_f5NWIM7blJeS-FUspiZqZqk-HD0gUGn87770nB_DB6_F97ne2ZkP6ihIk=s0
Imagestorm in a church,Dirck van Delen,," Dirck van Delen (1605 - 16-May-1671), Netherlands",nl,1630, Netherlands, Oil on panel,Rijksmuseum,1630,https://lh3.googleusercontent.com/tKQToOeboicBiwu5idqOH_Za0DFv2zCZqMfPEi-ft0MKIknUi7M8SHuxZauxDLTtWkFYbZDQZVSHA2xBPTPH-g1nYPg=s0
Marten Soolmans,Rembrandt van Rijn,," Rembrandt van Rijn (15-Jul-1606 - 08-Oct-1669), Amsterdam",nl,1634, Amsterdam, oil on canvas,Rijksmuseum,1634,https://lh3.googleusercontent.com/hDN8_JS4BbbksBXkxIDUldJvooejHBfQjgD3b_Jr73HjVOAs8thpnvCJA3WUtQFxlbjx-QB1-IyqhgEiM4dFLFk1Sg=s0
Landscape with an episode from the conquest of America,Jan Jansz Mostaert,," Jan Jansz Mostaert (1485 - 1553), Haarlem",nl,ca. 1535, Haarlem, oil on panel,Rijksmuseum,ca. 1535,https://lh3.googleusercontent.com/WCrF9xodQtLa9mWJnAlSx9Y9p3XZPUzq6Jq_2UVlRaBCbxeg8hSfyOwIArUTPOawTCMF8qCCX_mT3BO2EwPcRHcFLmN-=s0
Portrait of Elisabeth Troost (1730-1790),Jacobus Buys,," wife of Cornelis Ploos van Amstel, self-signed Jacobus Buys (19-Nov-1724 - 07-Apr-1801)",nl,1767, Amsterdam, Amsterdam,Rijksmuseum,1767,https://lh3.googleusercontent.com/KPDbeVKl5KW_dd0RJLK-0P6ZXauKxonTRtJ44bfLUS-rbwLiduMnfHrJeBjt2vnDR3UBI-jslI1GOltm-9BHQ1xa0CQ=s0
Skating competition for women on the Stadsgracht in Leeuwarden,Nicolaas Baur,," 21 January 1809, self-signed Nicolaas Baur (1767 - 28-Mar-1820)",nl,1809, Harlingen, Harlingen,Rijksmuseum,1809,https://lh3.ggpht.com/lm41K_bcrVzqm5CVFkLCqb8mIPvPWexyjIvAMy5OY0re44uwmeGiDqWQSSE6VkhM23QL2FqCZWAodr_nXvltCnPywUM=s0
Portrait of Jacob de Vos Jbzn (1803-1878). Art collector and owner of the Historical Gallery De Vos in Amsterdam,Nicolaas Pieneman,," Nicolaas Pieneman (01-Jan-1809 - 30-Dec-1860), Amsterdam",nl,1860, Amsterdam, oil on canvas,Rijksmuseum,1860,https://lh3.googleusercontent.com/9W7c3D8YFeji3yR-mZjeepuFrTICPHXbyU5vwz7r7Y1rIYgmNHaRA9l0SZQmzEjJ_NSkBzcGsYNuK6NOG6xvgnNkOA=s0
Wallpaper painting with Peace,Jurriaan Andriessen,," self-signed Jurriaan Andriessen (12-Jun-1742 - 31-Jul-1819), Amsterdam",nl,1786, Amsterdam, oil on canvas,Rijksmuseum,1786,https://lh3.googleusercontent.com/IXpmtfnO0jJasqqlBFh0NcBsPD7IgKo6IhlJ1MLa7hZM9qjwGbjWaEzFG9sv4QBGk8_40N_SzYNjEMoobsOaFof8nqw=s0
Portrait of Nicolaes Witsen (1641-1717),Michiel van Musscher,," self-signed Michiel van Musscher (27-Jan-1645 - 20-Jun-1705), Amsterdam",nl,1688, Amsterdam, Oil on canvas,Rijksmuseum,1688,https://lh3.googleusercontent.com/D39TDvx-A3-6TXIdcwoGw3LkweihKACS29H9CyXSPX20lQXNRSsI-BS5ZFNNcd0txUJj7dF82VFwk9dQ8ovDIG1wGg=s0
The Anglers,Nicolaas Verkolje,," Nicolaas Verkolje (11-Apr-1673 - 21-Jan-1746), Amsterdam",nl,ca. 1744, Amsterdam, oil on panel,Rijksmuseum,ca. 1744,https://lh3.googleusercontent.com/8lbem5vO_NXCscdHyqNT-9f-2-6CkAu55w7AG2k3iS0VLF1O9dOT53lReaxkySd4pQzMTvNDxNRYWD7_Yy22ctD0tg=s0
The birdwatchers,Nicolaas Verkolje,," Nicolaas Verkolje (11-Apr-1673 - 21-Jan-1746), Amsterdam",nl,ca. 1744, Amsterdam, oil on panel,Rijksmuseum,ca. 1744,https://lh3.googleusercontent.com/hyOElD26LQRBFX6JJ_DJNf-gUHJpU6a2QCxV3GfuzPReCTxq5oyIs3twIIW04KppkyHLtULb68tVIUMEzuZy3PqDBQ=s0
Evening mood with shepherd,Cornelis Lieste,," self-signed Cornelis Lieste (1817 - Jul 24, 1861)",nl,ca. 1855, Haarlem, Haarlem,Rijksmuseum,ca. 1855,https://lh3.googleusercontent.com/gTNZN-AlQ6tZQ7joZfdi9ZcJFjoXCdiwE7XNRiPNNYZuLIkjJ7gWqIUV6Iq0lXt9rIqYwaHVaWjESicTxwdbIDdRIz7V=s0
Still life with four fruits,François Bonvin,," glass and pottery, François Bonvin (22-Nov-1817 - 19-Dec-1887)",nl,1827 - 1887, France, France,Rijksmuseum,1827 - 1887,https://lh3.googleusercontent.com/zgO4XJjnh-nBf9aR8tQMrEZkg6_jna1lNIJ0ARCo9m4-dxIXfO9uqCnzd6OELITDBaR1mdfF2VeODRO_LDme6hJowPI=s0
Forest landscape with a cheerful company in a wagon,Meindert Hobbema,," Meindert Hobbema (before 31-Oct-1638 - 07-Dec-1709), Amsterdam",nl,ca. 1665, Amsterdam, oil on canvas,Rijksmuseum,ca. 1665,https://lh6.ggpht.com/QhzBZh5S3yTO759KglmhjU3e3PjGoBNhRfOlK7_nzTLW_ILT3rjP7kzRwyBD5nlaFVa0lLq8eG0Dv3C856S-gJxJSF4=s0
Memory,Jan Verkade,," self-signed Jan Verkade (18-Sep-1868 - 19-Jul-1946), Fiesole",nl,1893, Fiesole, oil on linen on panel,Rijksmuseum,1893,https://lh3.googleusercontent.com/0fZkQXwfXeENlbT0F2LOKPcqMylitVsg2P9oGpHlpxQZnbGQU6jZ3EbddZ5DVV9VStDcm26YfgJEBclyFSaKT3QIN0s=s0
Gaston de Foix (1489-1512). French army commander,anoniem,," anonymous, France",nl,1600 - 1799, France, oil on panel,Rijksmuseum,1600 - 1799,https://lh5.ggpht.com/LPqEYl6kCds606Zdi0vggW5pfOCZkgGvjh6UF22leO_GPz3B_FvhPQw8w3de-HrZHflIg9o_bE4F2rVyRuB9HF2RMfI=s0
A sitting monkey,Jan Weenix,," Jan Weenix (ca. 1642 - 19-Sep-1719), Amsterdam",nl,voor 1685, Amsterdam, oil on canvas,Rijksmuseum,voor 1685,https://lh3.googleusercontent.com/0UA23NcjIK3M9qWUxviVlNp69IE_GVELNwOCMqSmmCcS5pPWi7Zxy9mUcc8K30uIqsHMVAAAZWUBDKbxcT9QkFuj1fzF=s0
Seven chicks,Melchior d'Hondecoeter,," Melchior dHondecoeter (1636 - 03-Apr-1695), Northern Netherlands",nl,ca. 1665 - ca. 1668, Northern Netherlands, oil on canvas,Rijksmuseum,ca. 1665 - ca. 1668,https://lh5.ggpht.com/eS4EKkcPB9aBVVCSjYBwh30DwQl6bfXwL_-USHTKz0kh1uIrh-FiP0agyz_cD2l2kci83RTD5vc0cmgigw9L9y_2rQ=s0
Group portrait of four artists,Monogrammist GF (schilder),," Monogrammist GF (painter), London",nl,ca. 1680, London, oil on canvas,Rijksmuseum,ca. 1680,https://lh3.googleusercontent.com/RQdB7-1m7DATAARjSrljVtX-8YIzvbQJ2rH8ovH_63uFeU8wR1-Gg8cRkZRuYHlbvNzymrnIbLhZar2s4e3PuBXVGcP1=s0
Portrait of Margaret of Austria (1584-1611),anoniem,," anonymous, Southern Netherlands",nl,ca. 1600, Southern Netherlands, oil on copper,Rijksmuseum,ca. 1600,https://lh3.googleusercontent.com/IkMiFhkAhnwAPiHQZ-u5FwIf_ml_1gUB4SdwyIvpae9CipKlzWOMFlQJG4-gFuWAGgQCPopgljxyLfhqIXL_Qw8hmX8=s0
Adonis,anoniem,," anonymous, Low Countries",nl,ca. 1600 - ca. 1699, Low Countries, oil on panel,Rijksmuseum,ca. 1600 - ca. 1699,https://lh3.googleusercontent.com/o1bnzbLOZcU8Gh_WbL53121sCarqQuDl8kYAa4EjE5nx8Ou_gskXm6GgekIhm8M9qTGHtjGdDCWswRzR3yOLW8LI8NjG=s0
Flower still life with alabaster vase,Gerard van Spaendonck,," self-signed Gerard van Spaendonck (22-Mar-1746 - 11-May-1822), Paris",nl,1783, Paris, oil on canvas,Rijksmuseum,1783,https://lh3.googleusercontent.com/TURH1SREu_5JOSoPi_nfwWh0MmSgoZDgOA0-T-MaZ5zvscClciNuPM87wlLpbLDfxHcim--kkMw01cGwcJozT-LTTd4=s0
Portrait of Philip III (1578-1621),anoniem,," King of Spain, anonymous",nl,ca. 1600, Southern Netherlands, Southern Netherlands,Rijksmuseum,ca. 1600,https://lh4.ggpht.com/S7qO3AoJ2xy6N2XXkKUPfltgp2J2dxaM-iPBAYfvO2w_yJrk6nFR0giaqBNAxtJJV3WAU66gHy-AdMe0_DyKIWEwj9M=s0
Three children playing with a birds nest,Isaac Walraven,," rejected attribution Isaac Walraven (23-Mar-1686 - 11-Mar-1765), Amsterdam",nl,1718, Amsterdam, oil on copper,Rijksmuseum,1718,https://lh3.googleusercontent.com/95Jsh2GyfGdGbeLv_dd_bonEu8A6jMFmSiCGPC6vCpPrfJwhgvbbbrF40ohwnH3Rv0g-QkdHWOJodYJI9h1Z-Y8XKFc=s0
Dutch girl having breakfast,Jean-Etienne Liotard,," Jean-Etienne Liotard (22-Dec-1702 - 12-Jun-1789), Netherlands",nl,ca. 1756, Netherlands, oil on canvas,Rijksmuseum,ca. 1756,https://lh3.googleusercontent.com/xIy4KYVfvbRmRnk90yvmQ_V98wx6Zdnr68_YzQj5PsMgBd6h_mVr9gHkVESdG7qS1fb3_jpAMf97ESj239Ng2Fw_Jw=s0
Portrait of Isabella Clara Eugenia,Frans Pourbus (II),," infante of Spain (1566-1633), studio of Frans Pourbus (II) (21-Dec-1569 - ....)",nl,ca. 1600, Southern Netherlands, oil on copper ,Rijksmuseum,ca. 1600,https://lh3.googleusercontent.com/R1oCJJDYIA4QQxeweuOoVmAARxu_7pvo0TeldbXOwzClXP8YB5cVVXSlsGCFeHvGxSXxWWWZqds7mYLJkIYUzVscD3XR=s0
Portrait of Albert of Austria (1559-1621),Frans Pourbus (II),," Archduke of Austria, studio of Frans Pourbus (II) (21-Dec-1569 - ....)",nl,ca. 1600, Southern Netherlands, oil on copper ,Rijksmuseum,ca. 1600,https://lh3.googleusercontent.com/ihIviVY3Bdxm7Y8OjEfAS1cfBxo9NEsM16x29xwvWzvxIuJCVWjgeYw3DPe1MyzrlC1FTdTrao92d_KczbVQVONyOK0=s0
Pandora,Barend Graat,," Barend Graat (1628 - 04-Nov-1709), Amsterdam",nl,1676, Amsterdam, oil on canvas,Rijksmuseum,1676,https://lh3.ggpht.com/bcXhEz5UKo5Lm6LpxilU6QMWZLjz_cvEJt-59qIflbu3v5WLrON2F_br2kfrvRk0pjbQGZH5svzakYOy5gMtGwIeOkg=s0
Portrait of Philips (1566-95),anoniem,," Count of Nassau, anonymous",nl,ca. 1609 - ca. 1633, Holland, Holland,Rijksmuseum,ca. 1609 - ca. 1633,https://lh6.ggpht.com/WOPOZ-5r9zmK2olumsUyAhEpKTQa1M8qf9UnIVD7ZO8c_LYcWHgDoOyehr5ZQoT6HggezLXYVbIqsJJuY0Vqtggjuw=s0
Portrait of George Frederik (1606-74),anoniem,," Prince of Nassau-Siegen, Anonymous",nl,1636, Holland, Holland,Rijksmuseum,1636,https://lh4.ggpht.com/HZjYt9aPhpX9wiQOX1tyVeaG_ZXPaQ2B_kdJoef_Ybr9WFx3WmX3CpxrdbN0fDJyCczFiVO17kSKrPaOVJlQ92Wwelg=s0
Portrait of Lodewijk Hendrik (1594-1661),anoniem,," prince of Nassau-Dillenburg, anonymous",nl,ca. 1625 - ca. 1650, Holland, Holland,Rijksmuseum,ca. 1625 - ca. 1650,https://lh6.ggpht.com/uJaH4J0PBQ_U8celsURsBrOGSWzvT8JDPfHpmLehDM1DOt77eOpmy4aj4z8c8NPXMz8MNP5FaVGrN_7EPD93qG_svuE=s0
Anna leafing through a picture folder,Laura Theresa Alma Tadema (Lady),," Laura Theresa Alma Tadema (Lady) (Apr-1852 - 15-Aug-1909), London",nl,1874, London, painting,Rijksmuseum,1874,https://lh3.googleusercontent.com/MxP6w0M_ASup9dnYj-6J6NHR04q01Q9TnIMyBGAG-3K5926bnCS21MTxeBYPdNQHL__TetyG-7G6x7zyXRqlVLSu_6KA=s0
Pope Adrian VI (1459-1523),anoniem,," anonymous, Northern Netherlands",nl,na ca. 1520 - 1599, Northern Netherlands, oil on canvas,Rijksmuseum,na ca. 1520 - 1599,https://lh5.ggpht.com/i5mhEt78rikjIRvwtHePbbF5vzSIjTfKplhzDTadW0-0JmxPYdUjxOklaLHYIv4FVbzV6ty2ftH7FTWexT-WNMXg2g=s0
Willem van Oldenbarneveldt (1590-1634). Lord of Stoutenburg. Ritmeester in Spanish and State service,anoniem,," anonymous, Holland",nl,1634, Holland, oil on panel,Rijksmuseum,1634,https://lh3.googleusercontent.com/5NCwIKZu_gjepQeAoW3tQ7lq1izkv671e7HfSmhzeVW9_77WkpGMn7yn5mI1XeADOjyCpX5ope1dATrdpmNTYmm2ddU=s0
Portrait of a man,anoniem,," anonymous, Holland",nl,ca. 1635, Holland, oil on panel,Rijksmuseum,ca. 1635,https://lh3.googleusercontent.com/vNtiaZb6epZge_BDgRQQS4monG5ZPtkGb8B_7g8eQ7ZbWegd5vlp0GTHN55wdrXYCqJbAO1_6lCjcqqCoVOWyWSbXw=s0
Portrait of a captain with the family name Ripperda,anoniem,," anonymous, Northern Netherlands",nl,ca. 1615 - ca. 1620, Northern Netherlands, oil on canvas,Rijksmuseum,ca. 1615 - ca. 1620,https://lh5.ggpht.com/5EU_cgfTnZNqBN912MEkXojuc86GuYXEgcWvma_HQizoPtPzJ1KBEaOWCVLkJ9RJWifzeG0ahtETjcgRxIuKyFaDbU4=s0
Portrait of a man,anoniem,," presumably Willem van de Velden (1603-63), secretary to Hugo de Groot",nl,1657, anonymous, Holland,Rijksmuseum,1657,https://lh6.ggpht.com/cJdkKQmSht5D528cOe6Dz4RUIrDHMRp7HcQuVoXg3o9kBKnlpH7O9gDwSIewfnd-t-JdYvkGQTdNVno-13iadspi073R=s0
Portrait of a woman,anoniem,," presumably Elsje van Houweningen, wife of Willem van de Velden",nl,1656, anonymous, Holland,Rijksmuseum,1656,https://lh3.ggpht.com/BaWrogr20JBEyH9x7x7LF1h_5Xw8azsG0598UD2VsFSgN_BaGxEHqqd2UF5GUtempDjKF_12GwUjZjZ58Vszk0H7aPbz=s0
Portrait of a man,anoniem,," anonymous, Northern Netherlands",nl,ca. 1615 - ca. 1620, Northern Netherlands, oil on panel,Rijksmuseum,ca. 1615 - ca. 1620,https://lh3.ggpht.com/sWrg4ax5dHkVTyl1OI-pWuEg9AZqOqAsI9RLheWUsZeV5yWx4v-JxT4zMsL7XVX0WULjMshINy4ngTfBtP_ILpnzgw=s0
Tarquinius and Lucretia,anoniem,," anonymous, Northern Netherlands",nl,1700 - 1799, Northern Netherlands, oil on canvas,Rijksmuseum,1700 - 1799,https://lh4.ggpht.com/7CGz74fDeWJuiLqIbaDshrnn5ZeWDHttN9AuYBAYpYImeLXnsLwMRWh7FYW7IVJrXOueGvKE41sIK6mMEsPUHpSh4UyF=s0
Portrait of a woman,anoniem,," supposedly Theodora de Visscher, wife of Jacob Rijswijk",nl,1640 - 1650, anonymous, Amsterdam,Rijksmuseum,1640 - 1650,https://lh3.ggpht.com/RhRTxOK0JLposQe13oJq7fMgnacUsA6TEMkJg9agdgBb7ut2FVTmEu_bMcPE9NHLdL39uOd20ZizCfrm8wHAhyn0Xw=s0
Portrait of a man from the Rijswijck or Van Rijswijk family,anoniem,," anonymous, Northern Netherlands",nl,ca. 1610 - ca. 1620, Northern Netherlands, oil on panel,Rijksmuseum,ca. 1610 - ca. 1620,https://lh6.ggpht.com/wgXJN2cASFa7kQxktkfa_x-N8_w1plpeBZ7W00lz8htv04zaiB-drIlrZ75OREHYCmaxHdJGFB4oGzqYlKG4rzXHHA=s0
Portrait of Ursula (1594-1657),anoniem,," Countess of Solms-Braunfels, Anonymous",nl,ca. 1630, Northern Netherlands, Northern Netherlands,Rijksmuseum,ca. 1630,https://lh3.ggpht.com/3oF0m7SlWkHd1N5bI0nzoi3GTvF9z7CKfSCzq91ZOTMsOErpFnedMmpQyil5ICN6_-Hvtkjjz1simrp4uqndO2ZHhwg=s0
