Javanese court officials,anoniem,," anonymous, Java",nl,ca. 1820 - ca. 1870, ? Java, oil on paper,Rijksmuseum,ca. 1820 - ca. 1870,https://lh3.googleusercontent.com/E9pbUweicSThUFBXpATvlWlzEFp4kW4eibMjhZ91a9cKjTnloUd0Uu6M5VsVahCHo0bqyM9Y3GlrMFBfZ9Wth-KCj7U=s0
Johannes Siberg (1740-1817). Governor-General (1801-05),anoniem,," anonymous, Batavia",nl,ca. 1800, Batavia, oil on copper,Rijksmuseum,ca. 1800,https://lh3.googleusercontent.com/uRbiL9g1xFXdMWQuR26767k8zRIA3XtPt4XKKFgUYLKhyotpwLz1FLJYJ29Yqq_sdDIkiwhFLoLIbvipUiM90hZJTHb9=s0
Otto van Rees (1823-92). Governor-General (1884-88),anoniem,," anonymous, Batavia",nl,na 1884 - ca. 1899, Batavia, oil on canvas on cardboard,Rijksmuseum,na 1884 - ca. 1899,https://lh3.ggpht.com/r-llJ_KHODxWHVOAHC3daXXrNWuxMsmXWqp7AoMlPvGO2KjPSW8-fvzRswX0qrcE06V8Xg2yw6d-f4d4e7pNv-osXeA=s0
Arnold Adriaan Buyskes (1771-1838). General Commissioner (1816-19),anoniem,," anonymous, Batavia",nl,ca. 1865, Batavia, oil on canvas,Rijksmuseum,ca. 1865,https://lh6.ggpht.com/pblgvKss6O4FhUFDz_569mL_28cdcP1Sr_VrTaBS6dUYKfJ-HpboMEY91bpJSrkkZulXKsdtzoR8AZ3MRbXkI2iY8iM=s0
John Benedictus van Heutsz (1851-1924). Governor-General (1904-09),Hannké,," mentioned on object Hannké, Batavia",nl,1909, Batavia, oil on canvas,Rijksmuseum,1909,https://lh6.ggpht.com/_O87_u24-kpezhUF1ImyWHp3JrFWv2YB0FsoD-Ek7suB3f9ksFwJCpnsUdR8JiD1Kk9onBYvn6jc39qucxD2qPYIvg=s0
Portrait of Governor-General Petrus Albertus van der Parra,anoniem,," anonymous, Batavia",nl,ca. 1762, Batavia, oil on brass,Rijksmuseum,ca. 1762,https://lh3.googleusercontent.com/4Nochsk3GT9EcANpTktPRLqGqqzWEPkXPliZyg8jQ34GuU8au53Ew8uqg0viKYwBGMzHVB8-6_2GG6ZRGayPrUCoEN0=s0
Dirk Fock (1858-1941). Governor-General (1921-26),Jan Frank,," mentioned on object Jan Frank (12-Nov-1885 - 29-Aug-1945), Weltevreden",nl,1925, Weltvreden, oil on canvas,Rijksmuseum,1925,https://lh3.googleusercontent.com/EDSooHyc51NXuvzly-AFnzEyt32uc57kxjSJPNOB7AaHRGdJZJvnV3QS_oD87EjUn3wuK5vulvF9ZPGHnZuZm2QpAA=s0
Christoffel van Swoll (1713-1718),Hendrik van den Bosch,," mentioned on object Hendrik van den Bosch, Batavia",nl,1713 - 1718, Batavia, oil on panel,Rijksmuseum,1713 - 1718,https://lh3.googleusercontent.com/AHPh2sK3Ot8E5LZStS3cUB6Zi3xSsWyytUAQZH5siEeDm0Pvhb1SshjhnQj11qZbMX1TjQ3ophJzj6mGxqHAgxTqBZ4=s0
The dance around the golden calf,Lucas van Leyden,," Lucas van Leyden (ca. Jun-1494 - Aug-1533), Leiden",nl,ca. 1530, Leiden, oil on panel,Rijksmuseum,ca. 1530,https://lh3.googleusercontent.com/BhqE25cpBVQ8tZUZFsWs4W-cf6LRU0fFtUcC7k24OOjW5en5xJ7mNSfIZQKJZncp7M1B6f6PJrbr0H0MivzQzw_fXJU=s0
Portrait of a Haarlem citizen,Jan van Scorel,," Jan van Scorel (09-Jan-1495 - 06-Dec-1562), Haarlem",nl,1529, Haarlem, oil on panel,Rijksmuseum,1529,https://lh3.googleusercontent.com/Ebe2ATRWpsTQy5j1ApqWgb6Fdplr2CTnBUol4k1YagiROKfv2PYVYv--1HMfhFs7Ah1zbZ5xXVGklBIc_DKsojuqtJzM=s0
Oliver Cromwell (1599-1658). In a frame with allegorical figures and historical scenes,anoniem,," anonymous, Northern Netherlands",nl,ca. 1650, Northern Netherlands, oil on panel,Rijksmuseum,ca. 1650,https://lh3.googleusercontent.com/vAS4aZvdVWXL7LbU0L2z0hOTHp0gGVPYUJXa_mfSFaDjXU6o3BvN0lI_e8uRXXXWQocnuji5c0w8dQo30c5GaFmPSw=s0
Portrait of a woman,anoniem,," probably Anna Jagellonia (1522-96), Queen of Poland",nl,1570 - 1580, possibly anonymous, Cologne,Rijksmuseum,1570 - 1580,https://lh5.ggpht.com/0Bw-t8L_v1Xbt8FEO4fXcdMG_8TT36NIqLEqQhYfwaMbCIiFEyulEY8cQEGoR40vh3gb8hRL9237a9X8bbcZks7ZXg=s0
Portrait of a goldsmith,anoniem,," anonymous, Northern Netherlands",nl,ca. 1680, Northern Netherlands, oil on panel,Rijksmuseum,ca. 1680,https://lh3.ggpht.com/jd9ciyz5Gq0K22RG09EDh68bIp5075w95JJIzjCrBY4RCikyjSfS207Ue7jWWrbJytTwB2kFt6LwnoPd77zh7NWDupCa=s0
Flowers,anoniem,," anonymous, Venice",nl,ca. 1700 - ca. 1799, Venice, oil on canvas,Rijksmuseum,ca. 1700 - ca. 1799,https://lh3.ggpht.com/dB0HAz031i1qTuZkR2AkQ4Mls84AYUWryDqH6jF0nqbKgzxFMeKxENH-CI7AEPRgHsl4Nt0Gm8QWm42GCm-lBEPSSZ2W=s0
Saint Jerome in his study cell by candlelight,Aertgen Claesz. van Leyden,," attributed to Aertgen Claesz. van Leyden (c. 1498 - c. 1564), Leiden",nl,ca. 1520 - ca. 1530, Leiden, oil on panel,Rijksmuseum,ca. 1520 - ca. 1530,https://lh3.googleusercontent.com/iOsuCdVS20cPnaK0-fAiQVJi4bGdfqhJsIZNryxwStWk_45h6sTFcfEEoLWLA-qWjmczNwNte1oJcI_UyVEtMs7q8nJF=s0
Posthumous portrait of Herman Willem Daendels (1762-1818). Governor-General (1808-10),Raden Sarief Bastaman Saleh,," mentioned on object Raden Sarief Bastaman Saleh (ca. 1814 - 23-Apr-1880), Netherlands",nl,1838, Netherlands, oil on canvas,Rijksmuseum,1838,https://lh3.googleusercontent.com/EMoSbKIGJpZegRTzDskyD7v7BWgfrwwwfBE15fpyM-SBMI3yiTx9R-CwanS6nHoiGuWEW_Te5y-L3R9Rh-w-Tfgy8lY=s0
Portrait of Ottavio Strada,Jacopo Tintoretto,," mentioned on object Jacopo Tintoretto (1519 - 1594), Venice",nl,1567, Venice, oil on canvas,Rijksmuseum,1567,https://lh3.googleusercontent.com/3sf38kvWo5TyudM3wJnH-GWUuRdUETA0MT7E_G4JbzIIU-dZqF-S1xV2gEuQQfojCydoI_PVh_McJH0aElI7uu9mvg=s0
Putti with mirrors,Jacob de Wit,," Jacob de Wit (1695 - 12-Nov-1754), Amsterdam",nl,1725 - 1744, Amsterdam, oil on canvas,Rijksmuseum,1725 - 1744,https://lh6.ggpht.com/oGsNKcyXiYvOvZPzcn3Uq3LMJb_bJwLu6I7OiIoIGVx7aZ_dGADKY23SqMOTi7dbfFmr-AllGTOB7qXXWTl1-TcSLFyv=s0
Portrait of Marquis De Saint-Paul,Jean-Baptiste Greuze,," Jean-Baptiste Greuze (21-Aug-1725 - 21-Mar-1805), France",nl,ca. 1760, France, oil on canvas,Rijksmuseum,ca. 1760,https://lh6.ggpht.com/GgzDBzImQ7Fktt6H9wdON0HR4tdT35nVthmLC--nONy7dYeYPH1K8Yl0FPJj6V9721bUi7jtznnu01W1fJI6OHKLTwM=s0
Viglius ab Zuychem (1507-77). Frisian jurist,anoniem,," chairman of the Secret Council and member of the Council of State, anonymous",nl,ca. 1570, Southern Netherlands, Southern Netherlands,Rijksmuseum,ca. 1570,https://lh6.ggpht.com/vYSEZTU4dwOh7eOqcWsCBIhnQU3FQ0uPYI7jPs4TThDB-gDimdS-RZW2UhHtv21DqAJdplO9wuSBOcvLPO25iMA7m5s=s0
The parable of the rich man and the poor Lazarus. On the back the statues of Saint Peter and Mary with child on a terrace,anoniem,," in grisaille, anonymous",nl,ca. 1550 - ca. 1575, Low Countries, ? Low Countries,Rijksmuseum,ca. 1550 - ca. 1575,https://lh4.ggpht.com/LDjjPP43e9ThJNmoko2jI6-Bc8XDAIvgi_7K5LgAeKoqqB0PQCNZ0g26xtt7YAAKSSedliXL4XgwwdzkRfZMrCnNDTZ7=s0
Charles I,anoniem,," King of England (1600-49), in a frame with allegorical figures and historical scenes",nl,ca. 1650, anonymous, Northern Netherlands,Rijksmuseum,ca. 1650,https://lh3.googleusercontent.com/m0HYylCroR7qCpOgq2o-NWqAFCC5qbATNgSAUKLTYk5XGq_-9Niw55BG8L8UU3y9VqLlH9Rns_2FoG3njsAq_mrX9g=s0
Winter on the IJ for Amsterdam,Charles Leickert,," self-signed Charles Leickert (22-Sep-1816 - 05-Dec-1907), Netherlands",nl,1850, Netherlands, oil on canvas,Rijksmuseum,1850,https://lh3.googleusercontent.com/6G4H2WbBU1ALgKz_bhssi3LpJhVOK3HVx0uje70wxgLJSElAUYYPT2DF5cKBEyIqqNB3zaWBWXwGYd2oFdXDkrTyReMg=s0
Portrait of an unknown woman,Jan Jansz Mostaert,," Jan Jansz Mostaert (1485 - 1553), Haarlem",nl,ca. 1525, Haarlem, oil on panel,Rijksmuseum,ca. 1525,https://lh3.googleusercontent.com/zuxEPYk1sYRdcSwL36b7tItd_SEBskpGx0Nm9ys4vve64m1Pqmtvj4llh1vHEU0mK7UtM7D-RYdM0ZW6k-AoBKTWJQ=s0
Six putti with flowers and fruits and drawing attributes,Jurriaan Andriessen,," self-signed Jurriaan Andriessen (12-Jun-1742 - 31-Jul-1819), Amsterdam",nl,1782, Amsterdam, oil on canvas,Rijksmuseum,1782,https://lh3.googleusercontent.com/AmG2LBJllr6A30UYwWfv5aJteqCcCZoNIVS9FSWsuQ2j5P81gUZfB5lYbWdO9-jwR0ogFUlm4JkNtOvXTsLSl5KwDK0=s0
Decorative painting with plants and animals,anoniem,," anonymous, France",nl,1760 - 1799, France, oil on canvas,Rijksmuseum,1760 - 1799,https://lh4.ggpht.com/Em6xq0yKBWEvUGAk_aPziS76VI5hj_JnVHIDIfbg9QTzM8fAjpRVGxGCJ479HfOzGraxCNfCjuFHXXpI33HiYP-449I=s0
Portrait of Francisco Hurtado de Mendoza,anoniem,," anonymous, Northern Netherlands",nl,1601, Northern Netherlands, oil on canvas,Rijksmuseum,1601,https://lh3.googleusercontent.com/YNEa2o1ODLHGTrDcf17Cq1DOqP-YvDQAK482dwusrMRRSB0sfx4W_8HsUb48p0Bkl69QP-zKF4htVr4B9BVcJeEX4cg=s0
Decorative painting with plants and animals,anoniem,," anonymous, France",nl,1760 - 1799, France, oil on canvas,Rijksmuseum,1760 - 1799,https://lh4.ggpht.com/smKAxLSWTdVKkhd-8xJOAibF5yhJR0LsWgA6LaXGdOHsCrpDo7dZsm04-wOlmXcP9R0YJc_MaUxzZ6Xb6qkaSHxip-o=s0
Decorative painting with plants and animals,anoniem,," anonymous, France",nl,1760 - 1800, France, oil on canvas,Rijksmuseum,1760 - 1800,https://lh4.ggpht.com/EAEueQEgphuHkgIV1iIGmdqLeb3tDSsutQ7Kj6-jX3tzlW8wTAgogozDObg_PcvsAMVjDaFzWdbxGjA2nIAYGUT53VU=s0
The racecourse in Scheveningen,Charles Rochussen,," opened on 3 August 1846, self-signed Charles Rochussen (01-Aug-1814 - 22-Sep-1894)",nl,1846, Netherlands, Netherlands,Rijksmuseum,1846,https://lh3.googleusercontent.com/UmvgcKQknhW16Cz6-YNlw1nnSmZHNIwtzrqDCf3L937-JWdx9cKllwQOQ4lSz_0CaIejG8CGIBICmUiPF94vTm_2GY0=s0
The tree of Jesse,Geertgen tot Sint Jans,," environment of Geertgen tot Sint Jans (ca. 1465 - ca. 1495), Haarlem",nl,ca. 1500, Haarlem, oil on panel,Rijksmuseum,ca. 1500,https://lh3.googleusercontent.com/JFH1H42dK0WIfM8GaB_s533Le3OsEiyNenC45XuFXo2WfFdWiuA75Ahqf5bBNPsWccXAIHCc6rQ43FGnLYMIH7zdxw=s0
Gerrit Sichterman (1688-1730). General quartermaster of the cavalry,Cornelis Troost,," colonel of the Oranje-Groningen infantry regiment, commander of Grave",nl,ca. 1725, signed with his own hand Cornelis Troost (08-Oct-1696 - 07-Mar-1750), Northern Netherlands,Rijksmuseum,ca. 1725,https://lh3.googleusercontent.com/BkuXxo1nJFvjAYfplVo2FTcBnSA0XdY3C4OdWg-ZCGODbU0rGD_DWc44wvdljYF1vtn5SS0uoIz1eGhZmV5xNjqQMeQ=s0
Het Rapenburg in Leiden,Carel Lodewijk Hansen,," self-signed Carel Lodewijk Hansen (07-Aug-1765 - 09-Jul-1840), Netherlands",nl,1807, Netherlands, oil on canvas,Rijksmuseum,1807,https://lh3.googleusercontent.com/ZOCeKf9UdZg2z-1VOC2b1ybPNSRiYIFmE34ig7QYJudUl5wL_qme8pPDQBlW-i9oXiMn_MwHnHq46y7hf_XPQfaV4x_x=s0
Geertruy Haeck kneels in prayer before Saint Agnes,anoniem,," anonymous, Northern Netherlands",nl,ca. 1465, Northern Netherlands, oil on panel,Rijksmuseum,ca. 1465,https://lh3.googleusercontent.com/7pv_treCs1K1rQHfN-U8SqSIFKivAP2S8gaaDzZloIyerdH_iq3-VxOnRo92RwZOFlikkdhUVkB9gCJ5seK1O2MZ2A=s0
Pompeius Occo,Dirck Jacobsz.,," Dirck Jacobsz. (ca. 1497 - 1567), Amsterdam",nl,ca. 1531, Amsterdam, oil on panel,Rijksmuseum,ca. 1531,https://lh3.googleusercontent.com/ZJdEJuFG-PIGg_G_bYQTnh11NUARoBikIlKJIJKZSnmvQmqUCfEgofUBdBL2zKtwPFMR0yKi-d-eVvFD-kwjuv2OqofB=s0
Portrait of a member of the Van der Mersch family,Cornelis Troost,," self-signed Cornelis Troost (08-Oct-1696 - 07-Mar-1750), Northern Netherlands",nl,1736, Northern Netherlands, oil on panel,Rijksmuseum,1736,https://lh5.ggpht.com/5cC5A43gL66dAluLm3_Mp0NiZ7v6BZxwnD--37cz3fvjV087nF1NvkOjnlWs5KqnvgVtd1pcR-JcqkTCk8YKhWr_W3j8=s0
Gijsbertus Johannes Rooyens (1785-1846). Professor of theology and church history in Amsterdam,Jan Adam Kruseman,," self-signed Jan Adam Kruseman (12-Feb-1804 - 17-Mar-1862), Netherlands",nl,1828, Netherlands, oil on canvas,Rijksmuseum,1828,https://lh3.googleusercontent.com/c1LmjF6egwpeFgF4uU01_a9BimmD2Pn3Ylkb3ZQLf2KlDv2WOGfqJrRi_ll-togCM-AEuGhH9nDDxJgIUa4D4CX_Ig=s0
View of the Nieuwe Gracht near the Bolwerk in Haarlem,Wybrand Hendriks,," self-signed Wybrand Hendriks (24-Jun-1744 - 28-Jan-1831), Haarlem",nl,1800 - 1831, Haarlem, oil on panel,Rijksmuseum,1800 - 1831,https://lh6.ggpht.com/tm6lWvukZa8g3zINRWUpf9amz1IekGowYflHhNaofpFj2L8mGQ3rOEW6I4E-c5WSQPBAEQr1wb-4PBKzfmr2ANyBo9A=s0
Hendrik (1820-79),Nicolaas Pieneman,," Prince of the Netherlands, Nicolaas Pieneman (01-Jan-1809 - 30-Dec-1860)",nl,1840 - 1850, Netherlands, Netherlands,Rijksmuseum,1840 - 1850,https://lh3.googleusercontent.com/YjkicxNZq3cS3B3d4G28XqMKI3LTibcSinXFqWCUyIWCG7eSvwOvkwA5jh72C3aAb7woF_2P-7MhaCxpZDIhBst89vvz=s0
Portrait of Ambrogio Spinola,Michiel Jansz. van Mierevelt,," self-signed Michiel Jansz. van Mierevelt (01-May-1567 - 27-Jun-1641), Northern Netherlands",nl,1609, Northern Netherlands, oil on canvas,Rijksmuseum,1609,https://lh5.ggpht.com/ifT49A192eZ3FdP5f3gzR4SUmcO-CiSNPcHn3dV-P2OdPZoD_pDyY69NeoZCiKZofyvRzzCgNt6EFHtERtlSaoGpPA=s0
The Herepad in the Haagse Bos,Paulus Constantijn la Fargue,," self-signed Paulus Constantijn la Fargue (05-Jan-1729 - 11-Jun-1782), The Hague",nl,1778, The Hague, oil on panel,Rijksmuseum,1778,https://lh6.ggpht.com/5wHDyYD29KJ0pfXw62dJIvQvYEg1DsuCx50SjyKnXArIfks8F8hiT4bbTsceLMLTFsPU_aC47AYElCh6sstv0i9xjio=s0
Portrait of a man,Jan Maurits Quinkhard,," self-signed Jan Maurits Quinkhard (28-Jan-1688 - 11-Nov-1772), Northern Netherlands",nl,1744, Northern Netherlands, oil on copper,Rijksmuseum,1744,https://lh5.ggpht.com/ZNBaJaT9byECkbo6oPKdXZ37e515UkKH9SudjRvp6RQWiMf_lkfW2uzyOadsPqtITJSZQZR8dp78fN7U89hv95fEkQ=s0
Decorative painting with plants and animals,anoniem,," anonymous, France",nl,1760 - 1799, France, oil on canvas,Rijksmuseum,1760 - 1799,https://lh3.ggpht.com/K_AioPl2tHcFOvf7jaOY38xCZqkFIiQKGHwwEqV5oNF0pUCqtS5lLs4mOhaeAdeG74a8-4nKDahEOEjGymvMIjj6494=s0
Woman with unicorn,anoniem,," anonymous, Venice",nl,ca. 1510, Venice, oil on canvas,Rijksmuseum,ca. 1510,https://lh6.ggpht.com/fWPYuE9JJ4vfFCY4TbkavVOF84_280sFfW_FMSy54UYFcsgO-bb3qkk1HDcEX-aaXFKLl5eoOk7q5TYXQ-WLwGnEpxr_=s0
Man and Woman at a Spinning Wheel,Pieter Pietersz. (I),," Pieter Pietersz. (I) (1541 - 1603), Amsterdam",nl,ca. 1560 - ca. 1570, Amsterdam, oil on panel,Rijksmuseum,ca. 1560 - ca. 1570,https://lh3.googleusercontent.com/NfSzsZ_qp98cTgEAo3jUpSB8oRccw5VW0EQMsPJcMRBMuhzefLFTc2uLAHAgAxExx_frfGPtgEQnBiUal4IinKl4UNfu=s0
Saint Sebastian,Francesco Bonsignori,," attributed to Francesco Bonsignori (ca. 1455 - 02-Jul-1519), Mantua",nl,1470 - 1490, Mantua, tüchlein on linen,Rijksmuseum,1470 - 1490,https://lh3.ggpht.com/5lXUevpDCEl_3wFPKJ7zGsj_LBxNrcEjZOb44gZEwuT5CZ962aDu0OWnm568CAVkqzlQ_K4fugKG0IyG6k1kKaFd1VOp=s0
Payment of municipal salaries to the night watchmen in the Camera del Comune in Siena,anoniem,," anonymous, Siena",nl,1440 - 1460, Siena, tempera on panel,Rijksmuseum,1440 - 1460,https://lh3.ggpht.com/-rCbTvvpVYnWTl9MxHej2arbwtOH_EUKO7u6fv_IJLv2p_9A_ShvjYNuRCDRKkX_3zoPDYJQa4XB2U5jNNAAWcWkOA=s0
The Vision of Saint Francis of Assisi,Ludovico Carracci,," Ludovico Carracci (1555 - 13-Nov-1619), Bologna",nl,1583 - 1585, Bologna, oil on canvas,Rijksmuseum,1583 - 1585,https://lh3.googleusercontent.com/JDF63EMYQzOME5YzDDCM19Y8C2OjnMs3cPrwMhBA1h9Sg5NBTsZzpgLPYa6XrCl_JwWj1KZwBn1Adg7Lz7ojwRbxvz3F=s0
Two Evangelists,Gherardo Starnina,," Gherardo Starnina (c. 1360 - c. 1413), Florence",nl,ca. 1407, Florence, tempera on panel,Rijksmuseum,ca. 1407,https://lh3.googleusercontent.com/q5XxJ4kdOpTWe9xilwqd2OcV19LIkG7eyjFwhZy2JXxnHIzfAKU2mlrGq2gUvXom95HNSV_nSIaaFl6SDETJphHajPA=s0
Madonna of humility,anoniem,," falsification of anonymous, Florence",nl,1910 - 1930, Florence, tempera (?) on panel,Rijksmuseum,1910 - 1930,https://lh3.googleusercontent.com/ZvKHrxblQiXJxYyKhtshfCBJCXvcsHVkEyXClXtp0QeEuzEDvdBlye2_M1gDKi9sqqYJROWDYFHvY6GellxuTgDDqF4=s0
Maria Magdalena,Carlo Crivelli,," Carlo Crivelli, Ascoli Piceno",nl,ca. 1480, Ascoli Piceno, tempera op paneel,Rijksmuseum,ca. 1480,https://lh3.googleusercontent.com/XrE3cqsL3Cpk_vo9rB99AGsFGeLdu1Qumqs8BHvKcBr16iPtsjFv2wVWgtHknJ4-HiJ-2lhxHzl2LPcKKGgLd4FCnC8=s0
The Scourging of Christ,Luca di Tommè,," Luca di Tommè (ca. 1330 - after 1389), Siena",nl,ca. 1365, Siena, tempera on panel,Rijksmuseum,ca. 1365,https://lh3.googleusercontent.com/tfJuWSAH9gGmv3iBnEfBlCn0qQZvlZF_hxDSOMrx7QMN5Dtbn9XvdUX-WsOOKoA7YRL-Blkdj4B8-vSsbhfN2DIGBoQ=s0
Madonna of Humility,Bartolommeo Bulgarini,," Bartolommeo Bulgarini (in or before 1345 - 1378), Siena",nl,ca. 1353, Siena, tempera on panel,Rijksmuseum,ca. 1353,https://lh3.googleusercontent.com/XTH85DSHexVP3uxEya3apMYqQFCESZo1YKDfbBUeaTTnlszusulwfdyqdsc4T14BEK0x71-G20k_dRrEZXuKk8hwbVQ=s0
Govert van Slingelandt (1623-90),Jan Mijtens,," lord of Dubbeldam. With his first wife Christina van Beveren and their two sons, Jan Mijtens (ca. 1614 - 24-Dec-1670)",nl,1657, Netherlands, Netherlands,Rijksmuseum,1657,https://lh3.googleusercontent.com/oJkn_7Xqw5F5XaD_WaU_Y2yZ3H962OvJR6V3TnUFDecZFKGEab-g6aW13ReSMwfO8hEv_7jF23iWncLAd14SASYqKD9b=s0
Saint Francis of Assisi receiving the stigmata,Lorenzo Monaco,," Lorenzo Monaco (c. 1371 - c. 1425), Florence",nl,ca. 1420, Florence, tempera on panel,Rijksmuseum,ca. 1420,https://lh3.googleusercontent.com/SJ_vXkbewQmLrERuRey3slk4MoxgNIpinDBOj7wkYbZ9thVTqAEYgSy-lsz7-OzJtSzpTQB8_NpxORlJGkedLQBhYhM=s0
The Martyrdom of Saint Laurentius,Jacobello del Fiore,," with Two Benedictine Sisters, Jacobello del Fiore (.... - 1439)",nl,ca. 1425, Venice, Venice,Rijksmuseum,ca. 1425,https://lh3.googleusercontent.com/4T7deHVW2Fb9SH2PypBpVMi_otT-86YhAUSNKBDjH8kADLdzZ2NrQrQNg-iA-8HU1ecgmQSto5ury6RSTLg6qn-4oFYY=s0
Maria,Lorenzo di Niccolò,," attributed to Lorenzo di Niccolò, Florence",nl,ca. 1392 - ca. 1412, Florence, tempera on panel,Rijksmuseum,ca. 1392 - ca. 1412,https://lh3.googleusercontent.com/n3CwM_0HNQnjKOkB2fYpsCpCiVK2Rm0iMABH6aGmtBUbRKUhBmRDAOtqXl5XrecWELm3dlnnHE5E1hPztRA1OiNTnA=s0
The sweat cloth of Saint Veronica,anoniem,," anonymous, Venice",nl,ca. 1450, Venice, tempera on panel,Rijksmuseum,ca. 1450,https://lh3.googleusercontent.com/k-YDcEg5IaOOmbITSOhIuLbyckbTTftPTEgr0cnhKFGqzPMfA9ohv_h6ESSI9175xbrbEv_QqA5muS_hJh2AcNHqU3o=s0
The robbery of Europe,anoniem,," anonymous, Venice",nl,1550 - 1599, Venice, oil on canvas,Rijksmuseum,1550 - 1599,https://lh3.ggpht.com/vcfwLroYVmgiPYZPcBaTcSnUwk2r9hsOoQIU5ueDJkHisPQwCsXXUchJI7K2uMKKlyguyKqwh6iL9zAuQPcq7mER7A=s0
Frame painted with the Annunciation,Giovanni di Francesco del Cervelliera,," the Baptism of Christ, the Entry into Jerusalem",nl,1450 - 1460, Saints Cecilia and Catherine, the Mercy Seat and four Musician Angels,Rijksmuseum,1450 - 1460,https://lh6.ggpht.com/h1ppAfDg60lZNfeRrzHqwQg9DaZ0iqstaxFiyDAsEcDeZndBXS1mXXrE7bC73_CcFKkySM4Kg03Uj0G-uNztOcttWw=s0
Two Evangelists,Gherardo Starnina,," Gherardo Starnina (c. 1360 - c. 1413), Florence",nl,ca. 1407, Florence, tempera on panel,Rijksmuseum,ca. 1407,https://lh3.googleusercontent.com/2bOyZ8rYEsj5mdcgr1mCJ1v_irDrCu9jkmUPf0hrH9SRmOk-RlSo6WxrNoJGrFKcpl3FmBpGZz4XmAdMRypLXLEBLdG6=s0
A reading man,anoniem,," anonymous, Northern Netherlands",nl,ca. 1660, Northern Netherlands, cloth,Rijksmuseum,ca. 1660,https://lh3.ggpht.com/WBL6pekr2S8GaY7U3hQTxUlSU111kkpNJ4dyYPqnqkNXoWJKf_CUwBABHhWovAauft-uya-zln_n6gFqOuOzyXyLu1M=s0
The erection of Darius before the Battle of Issus,Apollonio di Giovanni,," Apollonio di Giovannis studio, Florence",nl,ca. 1450 - ca. 1455, Florence, tempera on panel,Rijksmuseum,ca. 1450 - ca. 1455,https://lh3.googleusercontent.com/nV6SKusm-gQSxUI7UI2PCism1-WWyui8TxhAXsmf58jwZJQNCKz_DV39T8n5UyFdwoStDhf2mqfrjAcgmqAcrxXwO-X_=s0
Portrait of Daniele Barbaro,Paolo Veronese,," Paolo Veronese (1528 - 19-Apr-1588), Venice",nl,1556 - 1562, Venice, oil on canvas,Rijksmuseum,1556 - 1562,https://lh3.googleusercontent.com/2koEKOugX2ukoo4WNq9N7QKYXf9yKc85-YyfZyGTSFjqXfEm-XjiFoK9r7cJkWbgjF7uW0WDvsX5HZX9eSmPtM5uOoM=s0
Mary with child,Adriaen Isenbrant,," attributed to Adriaen Isenbrant (ca. 1490 - 1551), Bruges",nl,ca. 1530 - ca. 1540, Bruges, oil on panel,Rijksmuseum,ca. 1530 - ca. 1540,https://lh3.googleusercontent.com/7MuARwoar68CIFAc9HWPAHuev72WGJ8xeKbPJ926hQaZ8ZynXmVj6eCPzYR7UAw9xC848s_S0hKAOZX7VxLBeg6pcg=s0
Pomona receives the fruit harvest,Cornelis Cornelisz. van Haarlem,," Cornelis Cornelisz. van Haarlem (1562 - 11-Nov-1638), Northern Netherlands",nl,1626, Northern Netherlands, oil on panel,Rijksmuseum,1626,https://lh6.ggpht.com/Mj0KQY67itMtM8YTIw2SP_HfNxWpm4Wtqn-pLr819eVYUMbio1CH30HjlIsw5Yf8n3aSiGZOXx7j0XoK_VwmF-Nlgw=s0
Jan de Groots bookshop and lottery office in the Kalverstraat in Amsterdam,Isaac Ouwater,," Isaac Ouwater (31-Jul-1748 - 04-Mar-1793), Netherlands",nl,1779, Netherlands, oil on canvas,Rijksmuseum,1779,https://lh3.googleusercontent.com/PwJMha2PjESwtU5BVxRmxv2OZmfXDpE1RDYnWwgkOFJkPDiYVrnPu3doJXO75e_wPkGj_6EXl9xLsrL3i_HCUaTHI-c=s0
River landscape with women reading palms,Arent Arentsz.,," Arent Arentsz. (c. 1586 - 18-Aug-1631), Low Countries",nl,ca. 1625 - ca. 1630, Low Countries, oil on panel,Rijksmuseum,ca. 1625 - ca. 1630,https://lh4.ggpht.com/pLYUjYLun8nZCFscmtfjuXAGV63BeAW-c6wxsc2DZzQFawh5-gRMP7XGvKxIKuNxeAPC-CDqIcrIM-S0i2X2kTb0img=s0
Portrait of a man,anoniem,," anonymous, Northern Netherlands",nl,ca. 1530 - ca. 1540, Northern Netherlands, oil on panel,Rijksmuseum,ca. 1530 - ca. 1540,https://lh3.googleusercontent.com/4-pTwgpIgw0VZRhTDt2RyWxjc4UzMYC7oIvDMUdK62V3KklAcrq4DdX97trBJvbm-TFBhycUkPNUcGe_7w4nDqoj5Q=s0
Portrait of Adam Wachendorff,Cornelis Ketel,," with a bubble-blowing putto, Cornelis Ketel (18-Mar-1548 - 08-Aug-1616)",nl,1574, London, London,Rijksmuseum,1574,https://lh3.googleusercontent.com/Rq-8hgNHbM0EzR-0PQnsmH7xCvjkFrYfzZoCroIIGETr502prXd83BaGnR22qZUtY7InR7LmgMzoQ0nr9OJo-2o0Ag=s0
Chariclea,anoniem,," anonymous, Haarlem",nl,ca. 1660, Haarlem, oil on panel,Rijksmuseum,ca. 1660,https://lh5.ggpht.com/BamlNpQ116tFZcV41MRdg6GdHOEOED9CObvMNVMyjzxdsq-QzHjJeSWD6a7zkan2wYFT_4f5U5Ld4EshMSTbL3WYWOEj=s0
The Carrying of the Cross,Quinten Massijs (I),," Quinten Massijs (I) (1466 - 1530), Antwerp (city)",nl,ca. 1510 - ca. 1515, Antwerp (city), oil on panel,Rijksmuseum,ca. 1510 - ca. 1515,https://lh3.googleusercontent.com/Pgh67R4LknEfRITsEEAMiopwFMHTM1TB4jSYpq8sxdJpaSJ3Q5BkRouWFNtEId0vN-s4GmGjYuPvggYfiSXqND2Puvw=s0
Christ Dedicates Peter: Feed My Sheep,Claude Vignon,," Claude Vignon (1593 - 10 May-1670), France",nl,1624, France, oil on canvas,Rijksmuseum,1624,https://lh5.ggpht.com/dLqKCaHeB8Oaf9whrDmy-ip453UlWY8us1c44iTFImMuGksN8X_XfGuReEwOT78d43pqs_wgDfiKuKmNx2TK6dW2q5U=s0
View of Constantinople and the Serail from the Dutch Embassy,anoniem,," Anonymous, Italy",nl,1700 - 1764, Italy, oil on canvas,Rijksmuseum,1700 - 1764,https://lh3.googleusercontent.com/Ujm51xv26eYSF7eNJBIMT1WAvoQ-7dNlox0gkmqGfBecNOdiAHXYC6GlftI3ijxf-gIfufe9ZalsBns2ZbwXk1HQig=s0
Portrait of Erard de la Marck,Jan Cornelisz. Vermeyen,," Jan Cornelisz. Vermeyen (c. 1500 - c. 1559), Mechelen",nl,ca. 1528 - ca. 1530, ? Mechelen, oil on panel,Rijksmuseum,ca. 1528 - ca. 1530,https://lh3.googleusercontent.com/8U6zGe3SqJ9Io-bQNsZUzZnH7zkTM2I6cDE7Th9ZYtNn-SA2t1-Q5Bzfidt_1i0pMBumya92vyW0xMXolBlELXTRaPs=s0
View of the Marienbosch coffee plantation in Suriname,Willem de Klerk,," mentioned on object Willem de Klerk (28-Nov-1800 - 11-Aug-1876), Dordrecht",nl,1829 - 1876, Dordrecht, oil on canvas,Rijksmuseum,1829 - 1876,https://lh3.ggpht.com/QnPLKOf-qKFtKLJWUrfvSK8k-AZpsV7wW3SQkTDUy4e_lZbfWl3Ya3p74t927gBqT5iX-mbGW9utT-4imNmWjS4CvQ=s0
Saint Sebastian cared for by Irene and her assistants,Jacques Blanchard,," Jacques Blanchard (01-Oct-1600 - Nov-1638), France",nl,1630 - 1638, France, oil on canvas,Rijksmuseum,1630 - 1638,https://lh3.ggpht.com/RoezE1iEnzfpEJBveXqxd_vEyEtYD0q-r_3GqOlEBEhR4rSFcoEFnr95iz1_sGCFnQFqw9eAbtnQuPOlP2cgCHpwe1M=s0
Inspection of a regiment of cavalry,Cornelis Troost,," perhaps by Willem van Hessen-Homburg, Cornelis Troost (08-Oct-1696 - 07-Mar-1750)",nl,1742, Netherlands, Netherlands,Rijksmuseum,1742,https://lh6.ggpht.com/snb6wiqdQqOPDtqTrtlrfBIiMsJOvPLf4yjJGZ10L7D6s-ZF1iWMlptoX1F_YQ6qFk5Z455alV5iY3IqaJNwds4tUkg=s0
Satire on celibacy,anoniem,," anonymous, Germany",nl,ca. 1600 - ca. 1649, ? Germany, oil on panel,Rijksmuseum,ca. 1600 - ca. 1649,https://lh3.googleusercontent.com/S5rZpg5UWxDzvRcti1qR61PgSCrOHve00yfLLsty1WhUVKh2CuiZkAy7PxB8N_BFWDUQOzPJhUe_Go8ifbjSx-4swQ4=s0
Bernardo Gritti. Proprefect of Bergamo,Carlo Ceresa,," Carlo Ceresa (20-Jan-1609 - 29-Jan-1679), Italy",nl,1646, Italy, oil on canvas,Rijksmuseum,1646,https://lh3.googleusercontent.com/NlGpgM4lhsXIXvBiv30YyVzrmGX4mAJSt_o130tBKsL8h0I-YEEWcQLEmMVHfzoeWisbKOTLsS4CBYuGjShw-MiOyg=s0
Italian landscape with pine trees,Hendrik Voogd,," Hendrik Voogd (10-Jul-1768 - 04-Sep-1839), Rome",nl,1795, Rome, oil on canvas,Rijksmuseum,1795,https://lh3.googleusercontent.com/3vIkB8iOpb9dSs5a9qcJUb9F4QO36lJvfhd8YZzqccc26xReRliueCyuQdkmzbUXAx-ShK1EPwu3-SFOlu1oOq0DtRc=s0
The shelling of the Kraton of the Sultan of Djambi by the government naval ships Celebes,anoniem,," Admiraal van Kinsbergen and Onrust on September 8, 1858",nl,1858 - 1865, anonymous, Northern Netherlands,Rijksmuseum,1858 - 1865,https://lh3.googleusercontent.com/Bu0nwp51eOejSHl72nCw74jY6Jwk5_2-Wl0gclZZaedf8Ht0xU7IVCvUpRCEGgFSLnzHZkgOftBDLNTDmKTBBjx3grrQ=s0
Meleager and Atalanta,anoniem,," anonymous, Northern Netherlands",nl,ca. 1675 - ca. 1699, ? Northern Netherlands, oil on copper,Rijksmuseum,ca. 1675 - ca. 1699,https://lh4.ggpht.com/9p4PtuG5FUQMWF6maoBp6njM6NTcan-8I-QpiPcfaY-UosuXrw88Tf_H8qDGwJMREoOZnDQ1jocJ_KuTaOhG2Ihegg=s0
The Batavian fleet before Veere,Engel Hoogerheyden,," 1800, Engel Hoogerheyden (13-Oct-1740 - 1809)",nl,1800 - 1809, Middelburg, Middelburg,Rijksmuseum,1800 - 1809,https://lh6.ggpht.com/gJtGBgTri7GnFxIFNeIWzkXljnJrnGu61H00gp8GeL3Z3YUdl3SzdA0ZM8HGZwzEM7MRFSnA3apNMKhFKkCteFrZAus=s0
Meadow with cows,Willem Maris,," Willem Maris (18-Feb-1844 - 10-Oct-1910), Netherlands",nl,1880 - 1910, Netherlands, oil on panel,Rijksmuseum,1880 - 1910,https://lh3.googleusercontent.com/dGOlcqtxocEKsfg4RCJviU2UzQseB5yVP2M71gROcuGGd4rD3mHMNVvlf2WzLW4oSg4JBvxM25OSbC881ptzLxSB53L2=s0
Portrait of a man,anoniem,," anonymous, Northern Netherlands",nl,1639, Northern Netherlands, oil on canvas,Rijksmuseum,1639,https://lh3.googleusercontent.com/XfapMRlmQPG6137bkel41O_91gRrUHfjPOHrBeOil1l9P0nHIcEQyN4RM_8hASrKCe3eRoQd4e9nv8QPIsLcs7GmQ9k=s0
Agatha Petronella Hartsen (1814-78). In bridal toilet on the occasion of her marriage to Jan van der Hoop on 17 March 1841,Jan Willem Pieneman,," Jan Willem Pieneman (04-Nov-1779 - 08-Apr-1853), Netherlands",nl,1841, Netherlands, oil on canvas,Rijksmuseum,1841,https://lh4.ggpht.com/rf4EX19R3IqR-gkU5RxqTOiQscsBmrhwyud8FYzM7BkZk92-d4O4WQHuMdciOrUN99raASJloQVZBgj-GXT8gQ6apw9D=s0
