Javanese court officials,anoniem,," anonymous, Java",nl,ca. 1820 - ca. 1870, ? Java, oil on paper,Rijksmuseum,ca. 1820 - ca. 1870,https://lh3.googleusercontent.com/E9pbUweicSThUFBXpATvlWlzEFp4kW4eibMjhZ91a9cKjTnloUd0Uu6M5VsVahCHo0bqyM9Y3GlrMFBfZ9Wth-KCj7U=s0
Elegant company on a driveway leading to a country house,anoniem,," anonymous, Southern Netherlands",nl,ca. 1650, Southern Netherlands, oil on panel,Rijksmuseum,ca. 1650,https://lh3.googleusercontent.com/QDL9Uj1CELXeweXi2kUKNCLQA4p8I0CZTjhDIrM_r95Bxou60wlehuLy9wEIZT2vUFsWpgRe13YfgcyFY3ixuw5QjA=s0
Michiel Adriaensz de Ruyter (1607-1676),Ferdinand Bol,," lieutenant admiral, copy after Ferdinand Bol (Jun-1616 - 24-Jul-1680)",nl,1650 - 1750, Netherlands, Netherlands,Rijksmuseum,1650 - 1750,https://lh3.googleusercontent.com/6ExJmqUG2Uzvh0I0Fki9EKBSYyp6a3VjHcQXqd4QlooEC90jG1nontqCRKXmzNxuUkvyT5Rmt57dviTQfqnjEOX6MHab=s0
Johan Arnold Zoutman (1676-1745). Lawyer,anoniem,," husband of Anna Margaretha van Petcum, anonymous",nl,ca. 1725, Northern Netherlands, Northern Netherlands,Rijksmuseum,ca. 1725,https://lh6.ggpht.com/6GVJPuUlbdLibvMOuU8b1ioEYdvvF_ptQNPGc-LBQHch0Tpyad15wvu2LIJf9mDaLnxbpU3G9EKtfHkEnDzzQG7X21xk=s0
The Tower of Babel,anoniem,," anonymous, Bruges",nl,ca. 1490, ? Bruges, oil on panel,Rijksmuseum,ca. 1490,https://lh3.googleusercontent.com/Tx5u6DiabgyjpIoeOwtIf3k2Ekp2E0priPFoxoy-NlUricPmFucwDBboB4d_X-t9Z_iCiraxA2whOXyNgf_8lAC6DCg=s0
Anna Charlotte Koppelaar (born 1821). Wife of Willem Frederik Wehmeyer since 1850,anoniem,," anonymous, Holland",nl,ca. 1850, Holland, oil on canvas,Rijksmuseum,ca. 1850,https://lh3.ggpht.com/gLYDfs9zHhein8f_K5Vu_nyJvTzwzrE2cuX-yZDNHMC80c-IYCENW72inU2EirZCEy-rEvNWmL89wU6-i3QKFHnOSv2U=s0
The Mass of Saint Gregory,anoniem,," anonymous, Brabant",nl,ca. 1500, Brabant, oil on panel,Rijksmuseum,ca. 1500,https://lh3.googleusercontent.com/apTnAnpnLdNbWIQtbpdknDSTEBwK9eUKFZszdYiYc5qCSd71DU4omMiVHv5CjutihAf1MHsWUJWh_CJ8Fc_MFcP_7bY=s0
The Baptism of Christ,anoniem,," Anonymous, Northern Italy",nl,1500 - 1549, Northern Italy, oil on panel,Rijksmuseum,1500 - 1549,https://lh4.ggpht.com/fHp33fSrcO42AgRKz7KXD6xBdiF4XoWJQ0TjuhjiVyHjdAoL3E8v_l4EtfBqsCHwSyG8yzIJDye9gqY_5Xhdm82O0dY=s0
Willem Frederik Wehmeyer (1819-54). Engraver,anoniem,," anonymous, Holland",nl,ca. 1850, Holland, oil on canvas,Rijksmuseum,ca. 1850,https://lh4.ggpht.com/Y6s_ZvMmP4Iw50EM8m5uJk7z_lEAH_myM_wSyH4TA7k50AqukexJf5zhDg6N4Iq8X04qPaKcyvyjeNvSbEcQOTSmEw=s0
Blooming tree in an orchard,Geo Poggenbeek,," mentioned on object Geo Poggenbeek (20-Jul-1853 - 04-Jan-1903), Netherlands",nl,ca. 1873 - ca. 1903, Netherlands, oil on canvas on panel,Rijksmuseum,ca. 1873 - ca. 1903,https://lh3.googleusercontent.com/7_5NGZo8rhYGNH8h1QeimMrgSOGpAKnY48W73uE8SFqZRPHUFD6bNcuJ9HXJFCJ3zNZCiGI_lydyxwgCvkk5jpDQc-Q=s0
Building site,George Hendrik Breitner,," George Hendrik Breitner (12-Sep-1857 - 05-Jun-1923), Amsterdam",nl,ca. 1900, Amsterdam, oil on canvas,Rijksmuseum,ca. 1900,https://lh5.ggpht.com/pFdaMy3sBAtCZsZdtuq39ws0xENRJUZQoKiCql-V071T5o2CiD6LD5zho8EBC--BBhL5Rn9sO4kLSZ2twoibuZvPMcmH=s0
The egg dance,Pieter Aertsen,," Pieter Aertsen (1508 - 02-jun-1575), Antwerp (city)",nl,1552, Antwerp (city), oil on panel,Rijksmuseum,1552,https://lh3.googleusercontent.com/tag3fYeclW652kg1ekaMTcPCJ5IOtuXDcKLEK5QK-xlHJ0VBx-2ee0FclmeB0jvmf_00apcOXtddMt3j9R0Q2oVVzkE=s0
The Willow,Geo Poggenbeek,," mentioned on object Geo Poggenbeek (20-Jul-1853 - 04-Jan-1903), Netherlands",nl,ca. 1873 - ca. 1903, Netherlands, oil on cardboard,Rijksmuseum,ca. 1873 - ca. 1903,https://lh3.ggpht.com/-6ikzf9zlLEA9S1xpCYmlktM7H7NoJAx8VIs7VyUKFRHg5NwEH-njwtg9lnEcDk9nGWzwk4utkWPSxCL2ot2eZiqVQ=s0
Madonna of Humility,Fra Angelico,," Fra Angelico (c. 1400 - Mar 18-1455), Florence",nl,ca. 1440, Florence, tempera on panel,Rijksmuseum,ca. 1440,https://lh3.googleusercontent.com/nBs6tVR7xKfYtEUzBZ6q6ToQQscGDHRiZT2vw7-6RVVqpFrlb6aUebKiEgRwwtktSm3Fm0rePhMWb9I7wJj3ChJnwHY=s0
Portrait of a young woman,anoniem,," Anonymous, Milan",nl,1480 - 1499, Milan, oil on panel,Rijksmuseum,1480 - 1499,https://lh6.ggpht.com/hsuBsRq6WadbvkON53y9xklxjbV00l-hh9eAR5OiohsnklGlYHBKpZa_EBlcPL1QRqy-pGGSEgYYZqdM3Rl6kwn8OE8=s0
Mary with Christ Child and John the Baptist,Meester van de Conversazione di Santo Spirito,," Master of the Conversazione di Santo Spirito, Florence",nl,ca. 1490 - ca. 1515, Florence, oil on panel,Rijksmuseum,ca. 1490 - ca. 1515,https://lh3.googleusercontent.com/piMtJBtroa8gNyWdlmgBRwrb-AjG9cIPH4I_suG0JCWzalZ4r_4wYHrNM_JBX98n-HE6zgblrA68wRmfr5TSidEvtbE=s0
Mary with the Child,anoniem,," Little John the Baptist, Peter and Anthony the Hermit",nl,ca. 1515, Anonymous, Venice,Rijksmuseum,ca. 1515,https://lh5.ggpht.com/HnOFOgiBOhpYUH4SPTQBS4NtqVkJO4iY1Y9HOl8-FZbsszjY_6fpLvjOQHmRMaD_n3_iwYqvAQI9mc_v9KxHrqLAmg=s0
Calf,Geo Poggenbeek,," black and white mottled, mentioned on object Geo Poggenbeek (20-Jul-1853 - 04-Jan-1903)",nl,ca. 1873 - ca. 1903, Netherlands, Netherlands,Rijksmuseum,ca. 1873 - ca. 1903,https://lh3.ggpht.com/XWCbUOIBnzHuokJ5a26uWQHRIhP-q99yQN5XeQD20_RX5NgpGtACDQ_deE6x0j68q9Yoayssm-QutEGdP1IFVOdHOGs=s0
Cow,Geo Poggenbeek,," mentioned on object Geo Poggenbeek (20-Jul-1853 - 04-Jan-1903), Netherlands",nl,ca. 1873 - ca. 1903, Netherlands, oil on canvas on panel,Rijksmuseum,ca. 1873 - ca. 1903,https://lh3.googleusercontent.com/xe5m0bvJr8Tr1gvbOANHSql6OejJUb-2R7H_lrNZWdYj-1VC6ld-r0erv3gvBelCT-sJXcG9_TzduoN-QIc5_suL21M=s0
Portrait study,Matthijs Maris,," mentioned on object Matthijs Maris (17-Aug-1839 - 22-Aug-1917), Netherlands",nl,1856, Netherlands, oil on panel,Rijksmuseum,1856,https://lh3.googleusercontent.com/1gsu73uDi-KHaBOOEBijdx1IFT-uXFT_EsuXb4MSykaznLcAti8ol6NBS3DaR3tCkw63ADQa06uBn0zT_aD9SS3Nzg=s0
Dieuwke Fountain (1800-79). Second wife of Adriaan van der Hoop (married 1834),Jan Adam Kruseman,," mentioned on object Jan Adam Kruseman (12-Feb-1804 - 17-Mar-1862), Netherlands",nl,1844, Netherlands, oil on canvas,Rijksmuseum,1844,https://lh6.ggpht.com/2gT1jbghqGWze-On1ygZclQjedGskFmUzOnBg-i501vZpUkwWw1eA_KWat0Ucrvztkh_GKw9CJQ3PHbVzvdBJi7vu0A=s0
Portrait of a nobleman in armor,anoniem,," anonymous, Brescia",nl,1540 - 1560, Brescia, oil on canvas,Rijksmuseum,1540 - 1560,https://lh3.ggpht.com/zcg0zhyPYi-MeCiVL94Uk5g0Cv_w4WrSh4goLLDfVtuCFMLfGBryQp3FmGQn_j1TAP4Abe439eqlhJ48ZaNIXLpZJg=s0
The clogs,George Hendrik Breitner,," George Hendrik Breitner (12-Sep-1857 - 05-Jun-1923), Netherlands",nl,1884 - 1885, Netherlands, oil on canvas,Rijksmuseum,1884 - 1885,https://lh3.googleusercontent.com/CNfbg72MLQhYjxa7minvoy2-GZJ6YqBzJp5ehwY0VwsNKgn_OG2bEtUZ42rEulzD95dJRrOt7mT3vq3WjxYYU-y3bw=s0
Alessandro de Medici (1510-37),anoniem,," Anonymous, Florence",nl,1525 - 1599, Florence, oil on panel,Rijksmuseum,1525 - 1599,https://lh3.ggpht.com/BAE_K3a2JmlmnBGP2ztIThknZkV5wA1Q9Bpgf5ZSgzOPALqu7Efq7abT-iOvsff2iJX-UTPz6IkJchCXQJbhtutyhtE3=s0
The Dutch attack on the Medway,anoniem,," 1667, anonymous",nl,ca. 1670, Low Countries, Lage Landen,Rijksmuseum,ca. 1670,https://lh3.googleusercontent.com/kMcTDsWjNQb5kNAGyGRCeUvLkSHosjkxVvVzU0jf6d0qaZc9IWOqXuVMUDH8es-xJK57Mv6Q8Cq31Aw4lIbBQIikow=s0
Church interior,Johannes Bosboom,," mentioned on object Johannes Bosboom (18-Feb-1817 - 14-Sep-1891), Netherlands",nl,1850 - 1891, Netherlands, oil on panel,Rijksmuseum,1850 - 1891,https://lh5.ggpht.com/tIKjXQFHxbEx2V1scMQUZBLxWbJViLXMN266cJ4mVRir3bVA0j9vJiiVzeCgZPYLjUWP9D-CiXbbNTom_nCNAeCe2tQ=s0
Girl Knitting on a Dune,Bernardus Johannes Blommers,," mentioned on object Bernardus Johannes Blommers (1845 - 15-Dec-1914), Netherlands",nl,ca. 1870 - ca. 1900, Netherlands, oil on panel,Rijksmuseum,ca. 1870 - ca. 1900,https://lh3.googleusercontent.com/PyYISiHEvxroT-uYMurQPGlMzcPORnAdJsJmXp8xDjTB2Mb2-SCKFBUZqL49u_7nuU7gOn2Du81SnV9906CFEDCtkog=s0
Boy and girl in the dune,David Adolph Constant Artz,," mentioned on object David Adolph Constant Artz (1837 - 08-Nov-1890), Netherlands",nl,1870 - 1890, Netherlands, oil on canvas,Rijksmuseum,1870 - 1890,https://lh3.ggpht.com/6gOSNIN3n_zo-wyWvvQSK9l5IyDhBX-at1RThUZZsPhsso51KXsYZ2dNda1wRiZS8_djil6SMJYP7-HkwgOvWwAZw7k=s0
Church interior,Johannes Bosboom,," mentioned on object Johannes Bosboom (18-Feb-1817 - 14-Sep-1891), Netherlands",nl,ca. 1840 - ca. 1848, Netherlands, oil on canvas,Rijksmuseum,ca. 1840 - ca. 1848,https://lh3.ggpht.com/u1ZYBqMXDv1oea_AIuaMPzGG9Bfz66T0a3H2_nnW5QxGjEP4pnxXxaWv0NZInPwoHJPoeoKcNYbsikvGXwP-GOrncQ=s0
Sunny day: a windmill on a watercourse,Paul Joseph Constantin Gabriël,," mentioned on object Paul Joseph Constantin Gabriël (1828 - 23-Aug-1903), Netherlands",nl,ca. 1860 - ca. 1903, Netherlands, oil on panel,Rijksmuseum,ca. 1860 - ca. 1903,https://lh5.ggpht.com/m1Eos9YDy7bfVY0lWFYCTh2VlbS_34Hgv6qEzssX8kTNkMAxNBC0tcQEM2NW9kvs7eCkkHMZSx6JjeWC9alRhhHPYKc=s0
The butterflies,August Allebé,," mentioned on object August Allebé (19-Apr-1838 - 10-Jan-1927), Netherlands",nl,1871, Netherlands, oil on panel,Rijksmuseum,1871,https://lh5.ggpht.com/b0v-hw8Al6aID7rCmNcNFookpIbNSsPv7gjRwtpCBLyMayYV8EruXqkKzQgLjYTh7z7yx4t0kVfqXqhMZ4ryGs0US3o=s0
Katjesspel,Henriëtte Ronner,," listed on object Henriëtte Ronner (31-May-1821 - 02-Mar-1909), Netherlands",nl,ca. 1860 - ca. 1878, Netherlands, oil on panel,Rijksmuseum,ca. 1860 - ca. 1878,https://lh4.ggpht.com/H808D6Peu5gGSmqtj-V7Fh03x0I8ViByG1_7Udt86ZFFyHu-0iHrBySqZVHRUrELD_gYXA7-0y0j9qfBwWgDo_HoUbQ=s0
Forest view,Théophile de Bock,," mentioned on object Théophile de Bock (14-Jan-1851 - 12-Nov-1904), Netherlands",nl,ca. 1870 - ca. 1904, Netherlands, oil on canvas,Rijksmuseum,ca. 1870 - ca. 1904,https://lh3.googleusercontent.com/Ou8qnd8J_EhtCrNrrGUzUBbJnfW61ysviamy_0ay6iY7WX9Kj28u-5e2uM-MGdEubP7SPEWHrUzBH147zQCsz_lGNCy_=s0
Bomschuit op het strand,Joannes Barnardus Antonius Maria Westerwoudt,," Joannes Barnardus Antonius Maria Westerwoudt (20-Dec-1849 - 02-Apr-1906), Netherlands",nl,ca. 1880 - ca. 1906, Netherlands, oil on panel,Rijksmuseum,ca. 1880 - ca. 1906,https://lh5.ggpht.com/gE1h4wY7yqlff1LeB0kmTHdVrqgqPpjoISeL4V3ZSjOSoKqGrI3SFVq6GZ5Y28L_TfBCoe4CTVvuOF2UjAVhflYEhuc=s0
Neighbor chat,Bernardus Johannes Blommers,," mentioned on object Bernardus Johannes Blommers (1845 - 15-Dec-1914), Netherlands",nl,ca. 1880 - ca. 1907, Netherlands, oil on panel,Rijksmuseum,ca. 1880 - ca. 1907,https://lh5.ggpht.com/4bhIgNLThPjC1stB1_al0j3I1QgGrqJFHjvOBwb6KIhtEwJivtOc7xeaobrb6IC0ER6pSJiaYw5h1Yxudc4Ww2t2zOw=s0
Forest view,Johannes Warnardus Bilders,," mentioned on object Johannes Warnardus Bilders (18-Aug-1811 - 29-Oct-1890), Netherlands",nl,ca. 1850 - ca. 1890, Netherlands, oil on canvas,Rijksmuseum,ca. 1850 - ca. 1890,https://lh3.googleusercontent.com/kqZJBtk5wy1QYtUibbC74q2HIKW-ZzGddO3snRFv1JHY2ES0sY2UWs3NXZEprl15QmW8x5PDFBCQj7eyCXo9FemuLZFK=s0
Cows at a puddle,Gerard Bilders,," mentioned on object Gerard Bilders (09-Dec-1838 - 08-Mar-1865), Netherlands",nl,1856 - 1858, Netherlands, oil on panel,Rijksmuseum,1856 - 1858,https://lh3.googleusercontent.com/TX40zmYIwyVAI1Lxqri63T63TveThu212SXckHFNb8FulXJb8TweiUunVyriVHBXeyo6gFrdW6pcnK97N10EHUzbE3I=s0
Saint Dionysius the Areopagite in prayer,anoniem,," Anonymous, Avignon",nl,1505 - 1510, Avignon, oil on panel,Rijksmuseum,1505 - 1510,https://lh5.ggpht.com/XpkxUAlzWcWPZW4iMLNEy_GmXEouWD19qYJ6u8bzfRI1OsxO5vdx1MaxK8u15SnCWPPLL1T6yvA4_4E1KZXoP6xQmUU=s0
Portrait of a woman,anoniem,," anonymous, Fontainebleau",nl,1550 - 1574, Fontainebleau, oil on panel,Rijksmuseum,1550 - 1574,https://lh3.ggpht.com/Xazj-DCKqMiI37x9HZ-I4e31mPhGPzN7g3r-xPTgzAWB7f98C2zCjHOdZ-Dsux4zD2p4JmFUv5_nsz3VK9xBpy0vquk=s0
Portrait of Engelbert II,Meester van de Vorstenportretten,," Count of Nassau, Master of the Princely Portraits",nl,ca. 1480 - ca. 1490, Southern Netherlands, Southern Netherlands,Rijksmuseum,ca. 1480 - ca. 1490,https://lh3.ggpht.com/mS3k6aP95jbZrrRtmylFzXQBEIn4HzMxqqc8aENtqgkqtoM8-j2NrMjtUL_8vHsHMiKRM84kxzN6zfVACSrrDKhQ3w=s0
The St Elizabeths Flood,Meester van de Heilige Elisabeth-Panelen,," Master of the Holy Elisabeth Panels, Northern Netherlands",nl,ca. 1490 - ca. 1495, Northern Netherlands, oil on panel,Rijksmuseum,ca. 1490 - ca. 1495,https://lh3.googleusercontent.com/2Q3sLSVZ4t08cqx9rDT7cB821VdrHOWQrme_5GBK_Riie06FtwqPLemr1Txm3--wuyKgNhmOGFqlAbivkM2rvfMEvFY=s0
Portraits of Sir Thomas Gresham and Anne Fernely,Anthonis Mor,," Anthonis Mor (1519 - c. 1575), Antwerp (city)",nl,ca. 1560 - ca. 1565, Antwerp (city), oil on canvas,Rijksmuseum,ca. 1560 - ca. 1565,https://lh3.googleusercontent.com/5bKxqWfm_J_Z9j_74FkNo44f5va7iGZEZTkFyzfXrIcQgOEtUI--nl9iHY63Qpki4mKo6Rqvnx_9fuQ-DrarZIKcsRFZ=s0
River Valley,Hercules Segers,," Hercules Segers (c. 1590 - c. 1640), Amsterdam",nl,ca. 1626 - ca. 1630, ? Amsterdam, oil on panel,Rijksmuseum,ca. 1626 - ca. 1630,https://lh3.googleusercontent.com/wjqlYqwCSlkzwE6URrfoN2gBMDHpyuK7vGcKvy-dHfkhUSONuGDvycvMHQ9P7vpCp739Mrrzs9CIZWVzmOIUIbvFwY01=s0
Adriaan Pit (1860-1944). Director of the Netherlands Museum of History and Art in Amsterdam,Marinus van der Maarel,," mentioned on object Marinus van der Maarel (01-Sep-1857 - 17-Mar-1921), Netherlands",nl,1880 - 1921, Netherlands, oil on canvas on panel,Rijksmuseum,1880 - 1921,https://lh3.ggpht.com/463ohPijJ6wHC6lsctuWrMzckBXVkx0d5nQkDeIXI-akkG7f06yMrjwFoU7ZhPXOYOCl446QKOf0u2k1CBUxfErMa7k=s0
The rag basket,Alexander Hugo Bakker Korff,," mentioned on object Alexander Hugo Bakker Korff (1824 - 28-Jan-1882), Netherlands",nl,ca. 1850 - ca. 1882, Netherlands, oil on panel,Rijksmuseum,ca. 1850 - ca. 1882,https://lh3.googleusercontent.com/_-BYeeOFVmlCOBIXmu7gjYQbL7VjhWtsvQk_5DlNHrurfvbeX_BUVO9LKKbiJifFfg7J6E_RBi_KYCJmcq4MeXuyVvYj=s0
Allert Boelisse (1523-59),anoniem,," copy after anonymous, Low Countries",nl,ca. 1550 - ca. 1624, Lage Landen, oil on panel,Rijksmuseum,ca. 1550 - ca. 1624,https://lh4.ggpht.com/KMsKO6gWZThXS8ns4RUhCZorJbPco0qEC_IMhynPBwY2xebuhzglEDzxg0bRn2DlvpFyziivh9qce0DZybLvMKAYpzU=s0
A man with a drawing of flowers,anoniem,," so-called portrait of Jacob Feitama Jr (1698-1774), merchant in Amsterdam",nl,ca. 1730, anonymous, Holland,Rijksmuseum,ca. 1730,https://lh4.ggpht.com/U4bXwVozDUmstZFMM1hBNgDsiYzgYoPxhHCrNo-sOXZK6gN68weLx6J2MNauMC7X0fch6hKkcSI3ymj60rp_agxo0TVq=s0
Portrait of a woman,anoniem,," anonymous, Northern Netherlands",nl,1633, Northern Netherlands, oil on panel,Rijksmuseum,1633,https://lh3.googleusercontent.com/xosaXlyjUXWz59ziGBZF4swh40MzhzJH27yEIrVUY8GElBLYRy_i9S88u6rA1pmdxP0AqdNqjoa8JeLcmCJbyrk_Y173=s0
Portrait of a woman,anoniem,," anonymous, Northern Italy",nl,ca. 1740, Northern Italy, oil on canvas,Rijksmuseum,ca. 1740,https://lh3.googleusercontent.com/HcpSBV7czkJtdphp6flNYgLeekoRwqW6eDmHLUe80w8t6-FjuiJQ2o_glGAP3fJaZMgmdiw8YUy4S_YHd2n3HjbICw=s0
Portrait of a man,anoniem,," anonymous, Northern Netherlands",nl,1633, Northern Netherlands, oil on panel,Rijksmuseum,1633,https://lh3.googleusercontent.com/ZhWzZqfw3z6i8pBOCDwal67Pe06HQ0RjseQU9cHQjuOQDTEkCl2zaOzUro6PPWduPtstZcrOuNjsL05foMgcwcTKbB4=s0
Portrait of Pieter Claesz Boelens (1582-1627),anoniem,," copy after anonymous, Northern Netherlands",nl,in of na 1627, Northern Netherlands, oil on panel,Rijksmuseum,in of na 1627,https://lh3.ggpht.com/CsJgsMRe5MxQE73NNogEFCUJQ0HS2EHFl3PDSCveO7t_W8FJujC_KIHi_iBfISz2Idn5njGBAEgpZpUggWe90G49za0=s0
Shepherds with herd of sheep,Anton Mauve,," mentioned on object Anton Mauve (18-Sep-1838 - 05-Feb-1888), Netherlands",nl,ca. 1870 - ca. 1888, Netherlands, oil on canvas,Rijksmuseum,ca. 1870 - ca. 1888,https://lh3.googleusercontent.com/WSaq476-Hrzh_fJOTWR-Evar5nzTR--95mRQJaKXI2sPZLDZCaYa0IqYvbutKopWgvqjHy0DZSaoso_pZ-O0cHVvTekM=s0
The St Elizabeths Flood,Meester van de Heilige Elisabeth-Panelen,," Master of the Holy Elisabeth Panels, Northern Netherlands",nl,ca. 1490 - ca. 1495, Northern Netherlands, oil on panel,Rijksmuseum,ca. 1490 - ca. 1495,https://lh3.googleusercontent.com/x2QTjIybsquxHKHYlNBxcrgnewe8nuXJ8un1Pu3GzdK78Ox3cWbd-6NB_ka0x5ddo0aZHfggkyT1k2FW4m4Xt0N27sM=s0
Portraits of Sir Thomas Gresham and Anne Fernely,Anthonis Mor,," Anthonis Mor (1519 - c. 1575), Antwerp (city)",nl,ca. 1560 - ca. 1565, Antwerp (city), oil on panel,Rijksmuseum,ca. 1560 - ca. 1565,https://lh3.googleusercontent.com/zzslCr693tcYk6zbGGUSbWFdkYQy9bXhjmhLJeFL7LH73yaVvNGSqVtSBj4rR3r3ObkQ-VXn61UGhVA6S4BCL3ejzg=s0
De Eendracht in battle with two Swedish warships during the Battle of the Sound,anoniem,," anonymous, Low Countries",nl,ca. 1670, Low Lands, oil on panel,Rijksmuseum,ca. 1670,https://lh3.googleusercontent.com/YU2DH9h7lZcwBDenq16cbB_aNxedrTb4_4gZPgcR1xudZeNyUQUW0-hQhYzUwe03x4vLqjkaNGhvx4-lsvr_KvRSTw=s0
Portrait of a man,anoniem,," anonymous, Brescia",nl,1550 - 1580, Brescia, oil on canvas,Rijksmuseum,1550 - 1580,https://lh3.ggpht.com/StaYxu9GYl3gj2c1LwPUXxKDsRGkHzYgFaKQ4cR7ZI5kd_jTocyaiS9ouuqXQBksVZ7lptKuNrL5Gmn7RHrSgHVbNTQ=s0
Saint Sebastian,Meester E.S.,," environment of Master ES, Upper Rhine",nl,ca. 1460, Upper Rhine, oil on panel,Rijksmuseum,ca. 1460,https://lh4.ggpht.com/o80MWZqGxRbJuwEV-UJB6tTE8uvDMCa6xGKZpnIxA5dPq6aLzm42h19HPlqFxsKTrOlepYerfdrbpxwC93Z4zu_Ozw=s0
Portrait of a young woman,anoniem,," anonymous, Holland",nl,1637, Holland, oil on panel,Rijksmuseum,1637,https://lh3.googleusercontent.com/KUHl3E2cp8ueaeSu4s_gIfCggVywrSbJLJM4kk9DT8cvI2k5HcTXVs4RpLtz2IIivX22lmwKV-co3K3gg_-fF5BIx-t-=s0
Playing yacht and warship,anoniem,," anonymous, Holland",nl,1675 - 1699, Holland, oil on panel,Rijksmuseum,1675 - 1699,https://lh3.ggpht.com/Qk4Y2DrdeEOxQwqI81cMLYpa3UenypZgf16QfpJXaxJkmuUzDKsXFJpGXoWF5t0BSeUA_Gh8dbpyWvJmt3QfPedCTA=s0
Horatius Cocles defended de Pont Sublitius,anoniem,," anonymous, Florence",nl,ca. 1450, Florence, tempera op paneel,Rijksmuseum,ca. 1450,https://lh3.googleusercontent.com/71Kpsl0mqxwkalm_XpKEudsIB6cutMdqIiL2QjqKXNA1cNligog59ISxS6yFjjxwlq3yJnsfl_3VA1jhlMp4xBG3_W4=s0
Portrait of Maximilian I (1459-1519),Joos van Cleve,," studio of Joos van Cleve (ca. 1490 - 1541), Antwerp (city)",nl,ca. 1530, Antwerp (city), oil on panel,Rijksmuseum,ca. 1530,https://lh3.googleusercontent.com/PklGgKaPrjgH8_uuA1QY0mtUSBrgBrKOUeG3YVHwYHoEI-zzuEbWf9f4uIzVeFvP0Mek9fjBOwtbEJEs5Yo6GN2Rzts=s0
Portrait of a man,anoniem,," probably Joris van Cats (ca. 1590-1654), anonymous",nl,ca. 1621, Northern Netherlands, Northern Netherlands,Rijksmuseum,ca. 1621,https://lh3.googleusercontent.com/LkYUWCdsCC9kFZa_cNXITco7rB1uTxA5UyDM9iDTlG2o_MKA4ujSMaRklsxnKau2rKcKJZRLkmvFlQC57VhhrSOsx4A=s0
Portrait of a woman,anoniem,," anonymous, France",nl,1740 - 1760, France, oil on canvas,Rijksmuseum,1740 - 1760,https://lh4.ggpht.com/l15ourjkbac7VE9x9tGTwzO6u7xgFzf1iYteezt6A9vjMo1rdowXwEu4lXCNBPTaEhTOE1uWjtf8z6ullnY2RDxlJg=s0
River view,anoniem,," anonymous, Northern Netherlands",nl,ca. 1635, Northern Netherlands, oil on panel,Rijksmuseum,ca. 1635,https://lh3.googleusercontent.com/vjEYWllT6QpCEhop5O-mA9_KWAt_PnkHHodaCTFfFjfayG9iktjbsiEk00Mi2w3Noucm2F1HCk8Mf1DmMkRmY2V2PtM=s0
Woman at a window,Jozef Israëls,," mentioned on object Jozef Israëls (27-Jan-1824 - 12-Aug-1911), Netherlands",nl,1880 - 1911, Netherlands, oil on panel,Rijksmuseum,1880 - 1911,https://lh6.ggpht.com/6G0LsfFsY_tO_o7_aYWn5gQbu2jnzGQFMIt2HCqDB5-4a3D0h06czKZjsRKkigjj8OSwOdP4Y_ZbB07DwE-C-NgoVy8=s0
Saint Anthony the Hermit,Meester E.S.,," environment of Master ES, Upper Rhine",nl,ca. 1460, Upper Rhine, oil on panel,Rijksmuseum,ca. 1460,https://lh3.ggpht.com/3cCwV-pR6bBOn2kTd4KbDOwpZtmQhLp-j6e2bj5EbVUKQZzi4jNrqiCYlnlD6GZxb-frYZzJHabxpxdrB-zlKkhwNNM=s0
Self-portrait,Émile Bernard,," self-signed Émile Bernard (28-Apr-1868 - 16-Apr-1941), Sevilla",nl,1897, Seville, oil on canvas,Rijksmuseum,1897,https://lh4.ggpht.com/5Q2CIHITfYAKdKN4-_Wen0JJONcL8SdG0HucHxGMgjsb9pYVHAswMQPTKezV7vUULZN78V8koxG3vlCq-5G6-CLEyqmj=s0
Mary with child,anoniem,," anonymous, Siena",nl,1430 - 1460, Siena, tempera on panel,Rijksmuseum,1430 - 1460,https://lh3.googleusercontent.com/d_fW2D9MOckCymm3MDNJ7US0p1yhwibtWb9mgyTBwukQG_fVWwikZsZRJIfsxTGtNBQ1tf_2rdZnkXqRUmkJrsnMS6w=s0
Farmhouse,Willem van Schaik,," mentioned on object Willem van Schaik (08-Aug-1876 - 08-Apr-1938), Netherlands",nl,1900 - 1938, Netherlands, oil on canvas on panel,Rijksmuseum,1900 - 1938,https://lh5.ggpht.com/hgLfJfItN5NkB_d3kBz5o1ReKMHXtnNFMNsQz2zUn-ousR9cVCdkmArkbvjKQkJMpcbY4q-XuOj6yLh-2etIk_v7l9I=s0
Portrait of a boy,anoniem,," presumably Giovanni de Medici (1543-1562), Anonymous",nl,1545 - 1570, Florence, Florence,Rijksmuseum,1545 - 1570,https://lh5.ggpht.com/_QbC-ECD2fHptINr_9AcbfobqzWfavHjoT5Wa2Xd3bcW-MRHj3lWWQnsTZsyvOnv1tLyPnxUrq4ObFDFAQ4H0F5SuSo=s0
Mary with Child,anoniem,," John the Baptist and Saint Clare, Anonymous",nl,ca. 1520, Siena, Siena,Rijksmuseum,ca. 1520,https://lh5.ggpht.com/phScoMBppd0Vjux6FfMZkZfbq2osI2DBUkjpLtlFWza54cndvm0SbNiGOeY6D6n18HlZfyD4aLuWbRbfuSexFeDZ2UGT=s0
The shell fisherman,Jan Toorop,," mentioned on object Jan Toorop (20-Dec-1858 - 30-Mar-1928), Domburg",nl,1904, Domburg, oil on canvas on panel,Rijksmuseum,1904,https://lh3.ggpht.com/zJAtK9zCATYesjDdqRJH93AKqeTJDeP3AZ2JxRTaQy1bUv4SZoLEuLM2Y3VypqiS4SYaphLOhdPbV7J570oO0dGQQVpV=s0
Portrait of a painter,anoniem,," anonymous, Northern Italy",nl,1700 - 1799, Northern Italy, oil on canvas,Rijksmuseum,1700 - 1799,https://lh3.ggpht.com/OnwBlSs1m4a2uHRwE29ypE2xfU4ovde0Mv8tykH5SSud9MT9EMlbPbathttElk5RtWB4KxgvjRaOLMfD9eFxX9DPxOU=s0
Two men in a landscape,anoniem,," anonymous, Venice",nl,ca. 1500, Venice, oil on panel,Rijksmuseum,ca. 1500,https://lh3.ggpht.com/U5WolhfU-xrRAtYxSGJpD_ABJ4vxrotSTlMgnJ46mWZlf3kncs79aIKjFs9vrB0QVS8E5VJ6IH8CwVVtdMwUTV_SvsvN=s0
The Descent from the Cross and Entombment,anoniem,," Anonymous, Florence",nl,ca. 1290, Florence, tempera on panel,Rijksmuseum,ca. 1290,https://lh3.googleusercontent.com/6-K6UNcBhfcuDjEqZCDiERDI_lDuHTveZ2y1UCHEJxqph6kRxrelnkTaVOVJYwSTTEHQg75TqwPFM9yf40dA2Qo26g=s0
The Descent from the Cross and Entombment,anoniem,," Anonymous, Florence",nl,ca. 1290, Florence, tempera on panel,Rijksmuseum,ca. 1290,https://lh3.googleusercontent.com/C8jssoJollwioqCzJ78SDyByeJGMDZkGrenTJ9oLTTFA751XwXNoXrr81Bl6TUrh7_iJbvfLoHHXP1E-LDQ9aZsWQA=s0
Saint Sebastian,anoniem,," anonymous, Florence",nl,1460 - 1499, Florence, tempera and oil on panel,Rijksmuseum,1460 - 1499,https://lh4.ggpht.com/Ad-0s2_l82t22JUqXmQZPZzeoXPqSvPazcOW8LPqIzJEwg5Na4Vt10NiwVr_q0JSQIbr-ZLdrwfQh4R_YonSBnQ9ZSI=s0
Portrait of an old lady,Vittore Ghislandi,," environment of Vittore Ghislandi (04-Mar-1655 - 01-Dec-1743), Milan",nl,1720 - 1750, Milan, oil on canvas,Rijksmuseum,1720 - 1750,https://lh4.ggpht.com/ceqEA4E_vQG93xiJvWBCEOVvnqfzUdM4-yFPkR_onYh7eIJSc2YBTvxWdmF6V18VPk0NpZ7oRKS9Hrxbx_mi8JnwwTQ=s0
Scene from a knights legend,anoniem,," anonymous, Florence",nl,1450 - 1474, Florence, tempera on panel,Rijksmuseum,1450 - 1474,https://lh5.ggpht.com/QIcxWmC4U9ZUb09utg6hDPqzsgoMUnm3qbgQ4WhzZI08b2UIWjD4qlbhf9p-_V7GTh-FcPrzGKo-D2r0Xl0KF9Y1p2lU=s0
Portrait of a woman,anoniem,," Anonymous, Milan",nl,1525 - 1549, Milan, oil on panel,Rijksmuseum,1525 - 1549,https://lh3.ggpht.com/kwfwA05mHgDgNJxVVM2OdzVDE0qxGcVdxuj67iHxiy9XDBWezyQzXHfUqWLgrGmfrgpyC7eREdlr24gFKNjv8yUIa88=s0
Portrait of a man,anoniem,," anonymous, Northern Netherlands",nl,1655, Northern Netherlands, oil on panel,Rijksmuseum,1655,https://lh3.ggpht.com/jMRmLTEHUl5_AjVAiDgrIqIiwKNyctev_xy47dSITQJ5zhZ3VYtockJpyniHd1h5TdMu09_fM5yNTBb22a3iPpDa_SA=s0
Farmhouse interior,Johan Hendrik Weissenbruch,," Johan Hendrik Weissenbruch (19-Jun-1824 - 24-Mar-1903), Netherlands",nl,1870 - 1903, Netherlands, oil on panel,Rijksmuseum,1870 - 1903,https://lh5.ggpht.com/6IYUf_2OopJLQdumL1NKuohuOlCE2wcxx1MU18U3DZ4EwLjKCkYgs9zk122brAFm2Ai8T2NNl1hRFvUEr5lu8fGd1s4=s0
The Apostle Paul,anoniem,," anonymous, Southern Netherlands",nl,1600 - 1699, Southern Netherlands, oil on canvas,Rijksmuseum,1600 - 1699,https://lh5.ggpht.com/2VrGc5OnVkzAyJiymLhJHHJ1sX533wGh8u9h4KRa1ILgJFomMctXcULJpQysJWnvnRvuxO_tXlzzmHI2B-8XjbHKqRCL=s0
De kruisiging,Niccolò di Pietro Gerini,," Niccolò di Pietro Gerini (.... - 1415), Florence",nl,ca. 1390, Florence, tempera op paneel,Rijksmuseum,ca. 1390,https://lh3.googleusercontent.com/B0slQzPSyMwijXbd2noqw68DGeW7zS9YGTIIT5d6004Igg3De79OClv1kZHDF4Euiol1SNL3R2GHBPLNzofeBxVdOkk=s0
Saint Dominic,anoniem,," anonymous, Florence",nl,1450 - 1499, Florence, oil on panel,Rijksmuseum,1450 - 1499,https://lh5.ggpht.com/JrVlvSe3-AeGXch_LcIqU0U3stjpPbiqHHNjDscwgRdpa6zwxp8-DijiHsY24d5iwE-lUivzWlCNAe8PVTe4fSNBXA=s0
The office of the tax authorities (biccherna) of Siena.,anoniem,," anonymous, Siena",nl,1451 - 1452, Siena, tempera on panel,Rijksmuseum,1451 - 1452,https://lh3.ggpht.com/KstwJ02skFxjulI06G7WkAWW0hsRm8DYGGZRPxsysqvG9QfZDvpYmKI-qbjkc907IUQ-VdF7Ei_12601u0vINMgU5eZl=s0
The Adoration of the Shepherds,anoniem,," Anonymous, Low Countries",nl,1550 - 1599, Low Countries, oil on panel,Rijksmuseum,1550 - 1599,https://lh4.ggpht.com/fIeENwKh2vyYrLkrEAEREbE9vFg8SRadO-MEgSSvCbMhZJx6leJ1mNdBSZ9ibW-TfL1eSTVkGQUtQw5PFrnhvTG4zmE=s0
The Flood,anoniem,," possibly anonymous, Northern Italy",nl,1450 - 1499, Northern Italy, oil on panel,Rijksmuseum,1450 - 1499,https://lh3.googleusercontent.com/6HluWq0wZly9d0BtTyPa_A1SO_inNr0M6xIssfFrz3f1i19Q_kdzc0VVyEmzNiTeli4YMnVEHu8CA8aLnHtY7OGk4ro=s0
A holy bishop,anoniem,," anonymous, Spain",nl,1475 - 1499, Spain, oil on panel,Rijksmuseum,1475 - 1499,https://lh5.ggpht.com/KL0QclyiQiXMtjGhyT0oW4ao0T6dOQ7BZJCp0zJKuoOVlS67oFU5Ins7PlH4UPCx159tSJhODhPSoK4jyqJe8fYPHRM=s0
The Adoration of the Christ Child,Cosimo Rosselli,," Cosimo Rosselli (1439 - 07-Jan-1507), Florence",nl,ca. 1485 - ca. 1507, Florence, oil on panel,Rijksmuseum,ca. 1485 - ca. 1507,https://lh3.googleusercontent.com/w3Jd0ZlXe7D_ZtkOvJwvgOMQSMbLWfuVROcZCGaSgfoDRtKCrhspRWqLzIHPLkIRvbc003eTCh9FI8NxD1trURGdyw=s0
The Deathbed of Mary,Meester van de Amsterdamse Dood van Maria,," Master of the Amsterdam Death of Mary, Northern Netherlands",nl,ca. 1500, Northern Netherlands, oil on panel,Rijksmuseum,ca. 1500,https://lh3.googleusercontent.com/XuYRk9o1BV1ypiXbkpSQHPdtIvuVlTQ2dHO57L-CNp1EnWyi7u7k0Jb1QzcaaRFjrco1gAYtMsoDDahcK0WP18O4HnLR=s0
